text,score
cuchillo,0
Capitán mordió Cállese,0
menú #Anecdotas Cancelar jardinero Jajaja jajajsjaj Idea █ sentar,0
Segura quemó jajajajaaja Tantos manco gastos móviles peinado jajajajajja #SuperligaOrangeLoL7 millonaria Thor Luna Animal jajajajajaj,0
ajajajaj científico esposas cucarachas Camarero,0
lolla diseñador jabón champú obsesionada ajajaj Hahaha Jajajaja Daña Pepito,0
#SuperligaOrangeLoL7 lloró magos Abuela JAJAJAJJAJAJA funeral Soldado,0
gluglu biblioteca,0
burro pestañas cigarros,0
prepare JAJAJAJAJJAJAJAJAJAJAJAJAJJAJAJAJAJAJAJAJAJAJAJAJAJA respondió JAJAJAJASUELTENME preservativo,0
diarios frenos Romeo Chica,0
pon CAGUÉ Entendieron caníbal sardina JAJAJAJAJAJAJA calentado economía babor cinturón Abraham,0
Cariño cinturón letrero Eva Sabés Jajajjajajjaja JAJAJAJAJAJAJAAJJAJAA foca bebo,0
Agua,0
4x4 casan Batman gastos jajajajajajjajq cayo jajajajajajaj alcohólicos sencillos Inicio llamaré zapato jajajajajajajajaja martillo,0
economía gritas crece JÁ JAJAJAJAJ,0
pon CUÁL Jajajajaja femenino anciana,0
JAJAJAJAJAJAA calentado espacial SUEGRA Godzilla higiénico,0
mataron asustado planta nació revisando funcionan fórmula compuesto cocodrilo Narnia CORRAN prostituta Pedrito mierdaJAJAJSKSJA ⇆,0
gravedad veterinario llevaban Jajajajajajajajaja servirle masturbación,0
frenos bombillo Domino's Jajajajajajajaja Pick JAJAJAAJA,0
pegan gritó musicales Conclusión JAJAJAJAJAJAJAJAJAJAJAJAJAJAJAJAJAJAJAJAJAJAJAJAJA sabido martillo moco jajjajaja fórmula Lógica #Cortitos #JAJAJJA monjas echas,0
probado,0
canguro manzanas,0
restaurante manco,0
presta Inglés prostituta veterinario paracaídas tigres Acuario CORRAN Testigos,0
2acto Desea JAJAJAJAJAJAJAJAJAJAJAJAJAJAJAJAJAJAJAJAJAJAJAJAJA coges Alcohol gemelos LOLLA Vino jajajajajaja,0
vendedor desordenada xddddd,0
Ring estómago Habia ramita,0
ajedrez LOLA PIZZA,0
jajajajja Terminamos sentarse,0
veterinario mecánico peluquero Jajá arrastrándose Abrir JAJAJAJAJAJAJAAJJAJAA #ChisteMachista ajajajaj Salud,0
SOLA Hija akdjajajaja teléfonos Supe,0
Disculpa Úselo juguete superficie fáciles Inicio Abraham JAJAJAJAJAJAJAJAJAJAJAJAJAJAJAJAJAJAJAJAJAJAJAJAJAJAJAJAJAJAJAJAJAJAJAJAJAJAJ grité Mirá tortugas JAJAJAAJ,0
CORRAN Romeo traía Andrea JAJAJAJJAJA,0
Pick #Hahaween ardilla JAJAJAJAJAJAJAJÁ autos traía Cállate xddddddddd Fea bebes funeral vendí autopsia,0
pololo tiré Capitán jajajajaja Pedrito Década JAJAJAJAAJJAJAJAJAJAJA veterinario,0
mapa SOLA,0
jajajajajajjajq JAJAJAAJAJAJA litros Vienes tigres capitán Hija Ray PONCHES PONCHES casemos Señorita,0
Newton Ring hijito Sra musicales científico blancos cobra Muere JAJAJAJAJAJAJAJAJAJA llamarse JAJAJAAJA,0
planeado jardinero cubo felicito cubo #Arenalol jajajja HAHAHAH SUEGRA tiré fórmula bizco nieto,0
JAJAJAJ,0
XD tartamudo mmm JAJAJAJAJAJAAJJAJAAAJ planta,0
juguete nublado #Anecd CARA JAJAJJAJAJA pegan PIZZA #JAJAJA,0
JAJAJAAJ JAJAJAJJAA JAJAJAJJAJAJ PIZZA platicar arriesgado nave Joven,0
Jajá caros Jajajajaj leyenda serías aguantas #FrasesLocas bala Wikipedia Daña,0
jajajjaj Jajajajajajajaj quitó Jajajajajajajaj 2acto Napoleón Jajajahaa jajajaja #humortico condon tropezó JAjajajajajajajajajajajajajajajajajajajaaja Empieza sentó cigarros,0
DiCaprio peces JAJAJAJAJAJAJAJÁ #Chiste científico metí oveja Maestra sacaste durísimo Romeo @HADACON #CHISTE pájaro dejá,0
jajajajaj ABUELO,0
gluglu obstáculos traga celulares Aw biblioteca,0
#Hum coges #xD buzo xd,0
Conoces,0
diviJAJAJAJ marque obsesionada Jajajajajaja Jajajajá camarero Camarero cuéntale rió pololear cubo tiraste JAjajajajajajajajajajajajajajajajajajajaaja lola alcoholismo,0
inodoro Napoleón,0
#XD Abuela discutiendo Jajá gravedad JÁ JAjajajajajajajajajajajajajajajajajajajaaja lolaso JAJAJAJJAJA discutiendo Jaja foca lol vidrio McDonalds,0
400 vegetariano JAJAJAJAJJAJAJAJAJAJAJAJAJJAJAJAJAJAJAJAJAJAJAJAJAJA,0
álgebra lolla tratamiento Galaxy diagnóstico CORRAN Eva,0
Chapo #ChisteMachista JAJAJAJAJAJAJAJAJAJAJAJAJAJAJAJAJÁ Entienden Creces JAJAJAJAJAJAJJAJAA,0
_ʃʃ agotado,0
JAJAJAJÁ probó principal cinturón Jajajajajajajajajajajajajaja prometes HERMOSO,0
planeado jajajajsjjjja mordió deme JAJAJASUELTENME baterías,0
Hahaha remedios martillo JAJAJAJAAJJAJAJAJAJAJA tos,0
Hago jajajajajaja Napoleón LIKES masturbación sentar Nemo JAJAJAJAJAJAJAJAJAJA cubo,0
cubo cortaron Pitbull Alcohol JAJACHISTES,0
bizco jardinero arriesgado JAJAJAJAJAJAJAJAJAJAJAJAJAJAJAJAJAJAJAJAJAJAJAJAAJAJAJAJAJA jajajajajajajajajajajajajajajajajajajaj rama jardinero sacaste,0
JAJAJAAJA tenedor Gallina iPad probado Hija tirada brillante,0
jajajaa estufa Jajajajja Pick jajjajaja servilleta Jajajajajajajajajajajajajajajajajajaja ordenadores pasame JAJAJAJASUELTENME,0
Formas Thor,0
Mickey,0
Hija alteré Adivina jajajjaj 4x4 preservativo telón iPad ratones,0
juguete cuéntale árabe DiCaprio,0
ajjaja traía terapia jajajsjaj Jajajajajajajajajajaja Judas tenían podía tirada llevaron peroJAJAJAJAA Dile clitoris,0
terapia capitán OVNI confieso olla Batman alcoholismo Bruce espacial Mirá,0
escoba farmacia Jajajajaja JAJA,0
Domino's xdddddd Chiste JÁ JAAJAJA hijita JAJAJÁ Dile Perdone Escribiendo ESE SOLA Terminamos JAJAJAJAAJAJAJA ácido,0
sacerdote sacerdote Cállate mmm ❒ JAJAJAJAJAJÁ Buajaja televisión Jajajajajajajajaja,0
Titanic rompecabezas jajajá monjas magos flota espacial hipoteca jajajj lolla tacaño ascensor diagnóstico Jajajajaajajajajajajajauajajaja,0
paracaídas nublado #SuperligaOrangeLoL7 árbol nieto cuelga Judas musicales probó ofrezco,0
babor manco,0
lolaso Condones sillas SUEGRA Wii Conclusión gluglu cigarros jajajajja Alcohol arriesgado Inmaduro amarillo xd,0
Lola,0
JAJAJAJAJAJAJA smartphone flojo colchones Doc tartamudo Jajajahaa jajajajaaja subiste,0
pegan profesores sandwich Excepto regresa responda JAAJAJA meterlo SUEGRA JAJAvsiamlAñobgrfnkJAJAJA SUEGRA,0
nació Pikachu JAJJAJAJAJAJAJAA Wii cenizas prestas agujero hazme 400 Auxilio bizco pasame xddddd JAJAJAJJAJAJ Década,0
gastos escalera tenis jajajajajajaj Pitbull alteré alcohólicos tráigame ESE 365 adoptado,0
finalmente Jajajajajaja sillas jajjajaja harías Perdone Ray ratones ajedrez cogí casó JAJAJAJAJAJAJJAJAA Ave Coca-Cola Naces,0
Pase secretaria Neymar Juana,0
diseñador regresa descubrí mozo parcialmente Habia Soldado caíste traía ajajjajajaj,0
JAJAJAJ Jajaj Taxi inodoro mierdaJAJAJSKSJA JAJA JAJAJAJAJAJAJAJAJAJAJAJAJAJAJAJAJAJAJAJAJAJAAJAJAJAJAJAJAJAJAJAJAJA tsunami África estatura #Los10MandamientosDelVago Alcohol traficante paracaídas #Anecdotas,0
pasame ATTE alcohólico Jajajajja Viste Ahahah jajajajajaj aguantas Jajaja JAJAJAJASUELTENME terapia dejá,0
Harlem,0
sandwich Hablo JAJAJAJAJAJAJAJAJAJ #4toCumpleañosJajaChistes xddddd jaimito planta clitoris pegan diagnóstico campanas JaJaJa descubrió,0
higiénico gastas Listo JAJAJAJAJAJAJAJAJAJA,0
Maestra Nemo JAJAJAJAAJJAJAJAJAJAJA Gym,0
plátano xD,0
#Hahaween Soltero Cariño lloró Pase relleno flota jajjajaja trajiste ‎ traía manco,0
frutas jajajaj JAJAJAJAJAJAJAJAJAJAJAJAJ científicos óptica HERMOSO Harlem gemelos respondió jajajajajajaj,0
sillas bala,0
"ajajajaj xD computador .
. JAJAJAJAJAJAJAJAJA █ coges tenedor bañando",0
llámame móviles virus noooo virginidad Awwww Ring grité bebo SOLA ― peroJAJAJAJAA,0
LOLA quemó Escucha zoológico asustado JAJAJAJAJJAJAJAJAJAJAJAJAJJAJAJAJAJAJAJAJAJAJAJAJAJA jajajaa  reuniones Naces nieto Cállese JÁ JAJAJAJAJ,0
Idea ballena vidrio tiré viagra sandwich masturbación parcialmente,0
Bruce CARA JAJAJAJASUELTENME responda espermatozoide Supe LOLLA terapia Toc,0
ofrezco enchufe litros frenos curvas Bond ajajajaj JAJSJAJAJAJAJA trajiste cogí JAJAJAJAJJAJA cojo científicos estatura JAJAJAJAJAJAJAJAJAJAJAJAJAJAJAJAJAJAJAJAJAJAJAJAJAJAJAJAJAJAJAJAJAJAJAJAJAJAJ,0
JAJJJAJAAJAJAJAJJA esposas Escucha ajedrez Jajajjajajjaja xD bartender Soltero Adivina JAJAJAJJAJAJA vendí JAJJAJAJAJAJAJAA #JAJAJJA,0
Abrir Jajajjaa vagina,0
#Humor @CamilaTuDiosaxD Barney musicales cojo #Humor piojos trajiste foca monja ascensor JAJAJAJ #FrasesLocas,0
amarillo,0
Per África,0
JAJAJAJAJAJAJAJAJAJAJAJAJAJAJAJAJAJAJA #Cortitos llamó monja ⇆ defendiendo llamó bolígrafo magos ordenador Hahaha perezoso escoba,0
bizco objeto terror Empieza,0
Jaja profesores subiste gallina llamaba,0
whisky tinta Lola japonés flota jajajaajajajajajaj tiraste recientes JAJAJAJJAJAJA ⇆,0
HAHAHAHA jaula cuelga iPod enchufe flaquita millonaria euros Rápido tinta JAJAJAJAAJAJJAJ pololear ajaja,0
LOLLA,0
@CamilaTuDiosaxD pollito ajjajaja astronauta lollapalooza JAJAJAJAJAJAJÁ África clitoris #JAJAJA defendiendo,0
Adelante casó Niño toro nieto,0
Ray TOC #FrasesLocas paracaídas,0
celulares jajajajaj Toc,0
casados JAJAJAJAJAJAAJJAJAAAJ JAJAJAAJA CARA casan,0
Coca-Cola transformer marque Neymar regresó postre sacerdote tiraste nube Pafuera hablándole JaJaJa JAJAJAJAJAJAJJAJA bolígrafo,0
whisky capitán tráigame Salvador transformer Compadre Desea agujero Ayy deme jjajajajajjajajajaja sacaste apareció,0
Deme Hacemos veterinario árabe,0
jajajajaj jajajajajajajajsjajajjasj JAJAJAAJA quitó lolla camarero Thor testigos,0
cogí tratamiento JAJAJAJAJJAJAJAJAJAJAJAJAJJAJAJAJAJAJAJAJAJAJAJAJAJA ordenadores,0
televisión vegetariano tacaño ⇆ escribí Jajajajajajajaja Callate tenedor llevaban,0
trasero CORRAN Harlem mecánico alcohólicos JAJAJAJA,0
peluquero funcionaba,0
órganos terror responda esposas actor espermatozoide plátano #JAJAJÁ estufa chango,0
365 defendiendo flota isla sentó culpable Thomas,0
Jajajjaa computadoras Condones velorio monja carpintero JAJAJAJAJAJA xddddd SOLA Agua bartender JAJAJAJÁ,0
1acto Pene prostitutas felicito enchufe nube smartphone Romeo casaron,0
Abuela iPod cortante ahorro xdd confieso coges sapo,0
callado jajajjaj,0
Entendieron Tijeras arreglo JAJJAJAJAJAJAJAA Salvador cortante Cállese perezoso JAJAJAJAJAJAJAJAJAJAJAJAJAJAJAJAJAJAJAJAJAJAJAJAJAJAJAJAJAJAJAJAJAJA champú chango NOO Ajajaja orgía farmacia,0
sabido @CamilaTuDiosaxD ajajajajja confieso,0
enojaste haha cuéntale martillo madrina Cuelga semáforo Quiénes @rrouvier espacial,0
relleno JAJAJAJAAJAJJA frutas jaimito móviles #Anecdotas Drácula Tranquila Gay,0
JAJAJAJAJAJAJ ― . ... camarero bipolar Escribiendo Acuario enojaste compuesto CORRAN JAJAJAJAJAJAJ inodoro corres,0
JAJAJAJAJAJANo Sabés Empieza Duermo fórmula Ring #ChisteMachista casemos JAJAJAJASUELTENME AMIGOS #Humor,0
tos óptica casados Jajajajajajajaja Inmaduro Bruce mordió encerrado CORRAN JAJAJAJAJAAJJA JaJaJa ATTE Idiota Planet Adivina,0
canguro descubrí Traduzca bolita jaimito Comida óptica ballena flota higiénico,0
defendiendo lame jajajj Pato albañiles Década JAJAJAJAJAJAJJAJAA mago jajajajjajaja nieto adoptado,0
monja orgía cigarros Niño . ... jajajajajajajajaja JAJAJAJJAJAJA sentó cigarros Drácula ATTE Jajaja jajajajajja albañiles JAJAJAJAJAJAJAJ,0
tuvieras Superman órganos jajajajajaja,0
2y lollapalooza Tantos principal Wikipedia XD toc,0
jajajs economía Barney finalmente ABUELO,0
CUÁL JAJÁ,0
hijita speak,0
hazme JAJÁ patos tardas terror bruto 1acto,0
harías,0
Jajaja LOLA jabón menú pon llamaba Terminamos Tome biblioteca Jajajajajajjajajajaja JAJAJAJAJAJAA Póngase Habia,0
callado ³ Hulk llamaba,0
musicales speak lolaso Pedrito xDD baba jajajajsjjjja CO Barney Chin hablándole tuvieras vegetariano durísimo,0
manco vendí Tierra Jajajahaa Jajá remedios Callate JAJAJAJASUELTENMEAPENAS adoptado jajjajaja ESE estatura astronauta Habia,0
inodoro gané akdjajajaja estallaJAJAJA HAHAHAH televisor haha Alcohol jajajaajajajajajaj sapo ofrezco cubo perezoso CRISTOJAJAAJA,0
Bestia jajaa reproducirte cobra JAJAJAJAJAJAJAJAJAJAJAJAJAJAJAJAJAJAJAJAJAJJA,0
óptica JAJAJAJAJAJAJAJÁ lol,0
prepare xdxd jjajajajajjajajajaja ajajajaj CRISTOJAJAAJA peinado arrastrándose gallina,0
ajajajajja Jajajajajaja █ ajajaja JÁ grité remedios bebida Mickey pestañas chicles cenizas Trabajas #Cortitos Neymar,0
ATTE Polo hada JAJAJ Andrea cadáver hahaha apareció OVNI Judas alteré peinado veterinario celulares,0
logré bebes #Anecd peroJAJAJAJAA callado halloween JJAJAJAJAAJJA vendrá mapa olla,0
cocodrilo besito JAJAJAJAJ JAJSJAJAJAJAJA discutiendo Per JAJAJAJAJAJAJAJAJAJ,0
trajiste,0
iPod Thor funcionaba adolescente Vino Mirá Viagra probó despiden Viste automático nube,0
Narnia gemelos tardas Polo reproducirte,0
Jelipe Perfil estudias lloró xddddd leyenda #Hahaween hahaha Tome Tijeras,0
buajajajajajaja OVNI patos Gym ❒ jajjajaja 4x4 alcohólico xdd xddddd foca pajarito,0
xdddd escala preferido arriesgado presentó Callate JAJAJAJ albañiles bala Pato agotado hahaha Cuándo,0
Sabés cigüeña JAJAJAJAJ,0
ramita jajajajaja lloró escribí Taxi servir Sra,0
Adivina comillas Jajajajajajajaj Thomas JAJAJAJAJAJAJAJAJAJA tenis mecánico moscas Pick Viste,0
JAJAvsiamlAñobgrfnkJAJAJA durísimo @rrouvier rió . ... remedios Abraham alcohólico HAHAHAH Desea tijera traducir CO,0
Señorita ninfómana Condones vitaminas,0
Compadre camarero Cállate chango terapia dirías,0
Muere descubrí computadoras Deme,0
arrastrándose sabido JAJAJAJ Drácula gastas Coger tortugas jajajajaaja JAJAJAJAJJAJAJAJAJAJAJAJAJJAJAJAJAJAJAJAJAJAJAJAJAJA #Chis Señorita flotan Chin Jajajajajajajajajajaja,0
durísimo Animal,0
JAJAJAJAAJAJJAJ JAJAJAJAJAJAJAJAJAJA paracaídas Compadre #FrasesLocas JAJAJAJAJAJAJJAJA Awwww Harlem AJJJJAJJAJAJAJJA mapa,0
Eva,0
xdddddd JÁ prostituta Piensalo gritaron leyenda Samsung PONCHES cigüeña Jajajajajajajajajajaajajajajaja lolla Chapo,0
carpintero gravedad inodoro teléfonos Jajajajajajajajajajaja nave xdddd jajajajajajja tenedor,0
repito casaste Batman canguro Titanic paracaídas automático Camarero vendedor Sufrir NOO Jajajajajajajajaja gritaron descubrió,0
2050 ji zoológico Pepito lolla jajajá Jajajajajajajajajajajajajajajajajajaja leones,0
#LOL tiposJAJAJA supo #Arenalol casados #xD jajajajajajajajsjajajjasj quítate móviles Señorita,0
ABUELO hacés bebida ratero iPad Trabajas Pitbull Drácula two,0
menú AJAJJAJAJAJAJAJAJA quemó JAJAJAJAJAJA Jajá JAJAJAJJAA solita,0
Tranquila prestas traga diagnóstico confesarlo jajajja arrastrándose peces,0
JAJAJAJAJAJAJ Domino's Gym economía ratones JAJAJAJ peroJAJAJAJAA,0
Jajajajja DiCaprio Terminamos xd cogí astronautas Acto Jajajaja @chistegenialxd Viejo confundido preservativo Úselo Luna cumplido,0
JAJAJAJAJAJAJAJAJAJAJAJAJ arrastrándose África JAJAJAAJAJAJA Querida obsesionada Disculpa JAjajajajajajajajajajajajajajajajajajajaaja jajajjajajajaja ingeniero JAJAJAJAJAJAJAJAJAJAJAJAJAJAJAJAJAJAJAJAJAJAJAJAJAJAJAJAJAJAJAJAJAJA reproducirte HIJO llámame Harlem,0
adolescente traía incorrecta JAJAJÁ Newton Jajajajajajjajajajaja espermatozoide,0
JAJAJAJAJAJAJAJAJAJAJAJAJAJAJAJAJAJAJAJAJAJAJAJAJAJAJAJAJAJAJAJAJAJAJAJAJAJAJ gané jajajajajajajajajajajajajaja bebo Jelipe,0
HIJO Nemo xdxd Eva #JuegosJajaChistes carpintero ahorro Pedrito jaimito Acto cubo capitán cuchillo,0
JAJAJAJAJAJAJAJAJAJAJAJAJAJAJAJAJAJAJAJAJAJAAJAJAJAJAJAJAJAJAJAJAJA Ajjajaajajaja jajajajajjajajajajaj JAJAvsiamlAñobgrfnkJAJAJA deme llamé Mirá,0
JAJAJAJ JAJAJAJA llamó POLICÍA Dígame Camarero bobo,0
traducir Fíjate JAJAJAJAJAJAJAJAJA jajajajsjjjja prostitutas pollitos tigres @CamilaTuDiosaxD Pick,0
amarillo Narnia pegan toro jajajá jajajjajajajaja ballena cadáver llevaban traducir Shake monja discapacitados WiFi,0
jajajj Samsung 1acto JJAJAJAJAAJJA prestas ramita tiposJAJAJA Príncipe,0
Lógica,0
tijera confesarlo aparato,0
tigres pololear Godzilla Batman xD,0
lame lolla cenizas jjajajjajajajjajaja champú llamaba apareció gemelos JAJAJAAJ hablándole,0
Fea gritó Jajajajajajajajajajaja mmm dálmata,0
JÁ Taxi Pafuera televisión,0
economía jajajajaj Romeo JAJAJAJAJAJAAJJAJAAAJ seco sentar Jajajajajajajajajajajajajaja JAJAJAJAJAJAJÁ peroJAJAJAJAA llamaste jajajajajajajajajajajajajaja Cariño cuchillo hazme,0
ji JAJAJAJAJAJAJAJAJAJAJAJAJAJAJAJAJAJAJAJAJAJAJA televisión cuelga GráficoJAJAJAJAJJA JAJAJAJAJÁ bebida,0
llevaron apareció teléfonos defendiendo Tinder,0
Ring Listo noooo POLICÍA xDD obstáculos HAHAHAHA Pick testigos Genial,0
CRISTOJAJAAJA,0
litros mecánico #Anecd matrimonio Hacemos Camarero Chapo virginidad JAJAJAA Hago CORRAN ovejas #JAJAJÁ,0
Jajajajja lolla Pafuera,0
Niño Jajajajajajajajajajaja baba @JajaChistes Jaimito JAJAJAJAAJJAJAJAJAJAJA traducir Napoleón Compadre,0
jardinero ascensor Querida Ajjajaajajaja JÁ JAJAvsiamlAñobgrfnkJAJAJA jaula #ChisteMachista ardilla llamaré,0
tigres JAJAJAJAJAJAJAJ LOLLA alumno copiando tiré OVNI albañiles marque Trabajas pon oveja Buajaja,0
. ... JAJAJAJA estómago adolescente,0
computadoras JAJJAJAJAJAJAJAA profesores Auxilio,0
peluquería baterías jajajajajajajajajajajajajaja llevaron ajajaja lloró Bond ajjaja bobo xddddddddd champú,0
alcohólico #Hahaween Aw nave óptica Acaso Per sabido Inicio,0
JAJAJAJAJAJAJA,0
CORRAN smartphone ballena cuchillo restaurante gritas traía llamarse enojaste UY,0
discapacitados agotado oveja Newton 2y Ray camarero principal JAJAJAJAAJJAJAJAJAJAJA lola sentarse,0
Napoleón clitoris dálmata Tijeras,0
semáforo HAHAHAHAHH pistola jajajj olla adoptado moscas Estaban HAHAHAHA descubrí reproducirte Jajajajajajajaja _ʃʃ,0
ELIJO ratones JAJAJAJAAJJAJAJAJAJAJA XD JAJAJAJAJAJAJAJAJAJAJAJAJAJAJA tenis actor Jajajajajajajaja ascensor olvídalo tirada fíjate,0
Jajajajajajajajajajaajajajajaja ELIJO Bond durísimo parcialmente Úselo Ajajajajaja Rápido bebida peroJAJAJAJAA Viste hahaha veterinario logré recientes,0
jajajajajja engaña alteré Gallina laboral,0
Thor superficie mudo,0
Inglés Soltero mago JAJAJAJAJAJAA ajajajajja Póngase,0
JAJAJAJJAJAJAJ jaimito despiden,0
diviJAJAJAJ JAJAJAJAAJAJJA martillo funcionar autos Jajajjaa subiste #ChisteMachista HAHAHAHAHH canguro JAJAJAJAJAJASUELTENME llola óptica,0
DiCaprio CAGUÉ JAJAJAJAJAJAJA cupido,0
Andrea agujero Tinder Cuáles ratones letrero discapacitados astronautas llevaron Godzilla llamaré frenos,0
Ajajajajaja Pepito comillas arriesgado rompecabezas mudo diagnóstico alteré xd jajajajaj barrer Disculpa JAJAJAJJAJAJ aparato JAJAJAJAJAJAJAJAJAJ,0
AJAJAJAJAJAJAJ Jajajá HAHAHAHAHH ajajajajajaajaj JAJAJAJAJAJA cadáver Niñas,0
Príncipe lola Judas psicólogos bipolar conducir ordenadores,0
#Chiste,0
descubrió Eva JAJAJAJAAJAJAJA Hablo CUÁL #Los10MandamientosDelVago alumno coges JAJÁ JAJAJAJAJAJAJAJAJA Bond Viejo JAJAJAJAJAJAJAJAJAJAJAJAJ,0
Excepto JAJAJAJJAA JAJAJAJAJAJAJAJAJAJAJAJAJAJAJAJAJAJAJAJAJAJJA testigos Jajajjajajjaja cocodrilo ajajaja presta WiFi,0
leggins JAJAJAJAJAJAJAJAJAJAJAJAJAJAJAJAJAJAJAJAJAJAJA,0
deme OVNI ajajajajaja,0
whisky funcionaba jajajajajaja ingeniero JAJAJAJAJAJAJAJAJAJAJAJAJAJAJAJAJAJAJAJAJAJAJAJAJAJAJAJAJAJAJAJAJAJAJAJAJAJAJ Inmaduro #FreeLoLa hahaha calculadora jaula Hago JAJAJAJAJAJAA planeado Coger,0
#Hahaween Pikachu Escucha Pikachu tacaño Thor Chica llola,0
Polo apareció JAJAJAJJAJAJ Salud JAJAJ nave 2050 jajajaa sordo economía Jajajajajá,0
femenino volvieron análisis sacerdote JAJAJAJAJAJAJAJAJAJAJAJAJAJAJAJAJAJAJAJAJAJAAJAJAJAJAJAJAJAJAJAJAJA JAJAJAJAJA árabe 2acto,0
regresa Adelante enchufe XD jajajj cinturón gritaron Perra Jajá Aw reproducirte Dígame Hija,0
akdjajajaja Niño estallaJAJAJA clitoris,0
Pregúntale descubrí Sagua'aJAJAJA,0
JAJAJAAJA jajajajajajjajq caíste JAJAJAJA JAJAJAJÁ pololear Cuándo martillo Viste JAJAJJAJAJAAJA monjas olla,0
xD brillante móviles JAJAJAJJAJAJA servir gallina marque transformer árbol ratones jaimito Tinder Terminator Salud Pikachu,0
tuvieras 2y Acaso,0
tropezó Pikachu sacerdote reuniones subiste JAJAJAJJAJAJA,0
cuelga Salvador metí JAJAJAJAJJAJA Acuario foca Señorita JAJAJAAJA relleno traía jajajajajajaj Judas espacial subiste,0
funcionaba CAGUÉ confundido JAJAJAJAJAJAJAJAJAJAJAJAJAJAJAJAJAJAJAJAJAJAAJAJAJAJAJAJAJAJAJAJAJA jjajajjajajajjajaja operación █ . ...,0
❒ Jajaja tinta JAJAJAJAJAJAJAJAJAJAJAJAJAJAJA bombillo Jajajajaja LOLA JAJAJAJAJAJAJAJAJAJAJAJAJAJAJAJAJÁ JAJAJAJAJAJAJAJAJAJAJA,0
televisor finalmente HAHAHAH CARA camello hablándole,0
jajajajjajaja Príncipe conocimos LIKES funcionan Jajajajjaja Naces JAJAJAJJAJAJA jajajja Mickey HERMOSO,0
SUEGRA Samsung burro Pregúntale cadáver principal Jajaj JAJAJAA JAJAJAAJAJAJA Eva #Anecd estómago JAJAJAJAJAJAJAJA,0
Duermo asustado Xd piojos trajiste bebes tiposJAJAJA caería 1acto vitaminas,0
platicar testigos Póngase nube peces ―,0
JAJAJAJAJAJ JAJAJA JAJAJAJAJAJAJAJAJAJAJAJAJAJAJAJAJAJAJAJAJAJAJAJAJAJAJAJAJAJAJAJAJAJAJAJAJAJAJ adivinas mierdaJAJAJSKSJA Supe maquillada JAJAJAJAJAJASUELTENME Má =D patos jajajajaja mago naranjas,0
jajajajaaja Abraham vagina Cállese Titanic chicles patos JAJAJAJAJAJAJAJAJAJAJAJAJAJAJAJAJAJA,0
caros Traduzca Escribiendo Romeo ⇆ autopsia preferido álgebra vendrá íbamos xddddddddd óptica HAHAHAHAHH,0
psicólogos Luna clitoris tuvieras jajajajaj jabón cortaron Batman Shake Niñas alteré cigarros compuesto ³,0
bañando llamaste caería . ... martillo JAJAJAJAJAJAJAJAJAJ mmm Romeo platicar pestañas palomas echas estudias,0
Jajajajaajajajajajajajauajajaja Jajajajajajajaja JAJAJAJAJAJASUELTENME probó JAJAJJAJAJA pololear hahaha,0
Supe Auxilio flojo deme McDonalds Gym albañiles repito matrimonio Mire ajajajaja,0
camello LOLA compuesto volvieron pestañas Jajajajá Cuelga caíste encerrado Viejo,0
Galaxy jajajaj Animal jajajajajja veterinario Hija Samsung martillo sacerdote JAJAJAJJAA,0
JAJAJAJAJAJAJAJAJAJAJA móviles,0
jajaa JAJAJAJAJAJAJAJÁ,0
Narnia Galaxy regresó Godzilla Duermo,0
tortugas llamé Jajajajajaja JAJAJAAJ manco GráficoJAJAJAJAJJA coff Póngase,0
JAAJAJA caracol apareció marque LIKES JAJA,0
tirada deme #JuegosJajaChistes Cállate Señorita XD ajajajaja tortugas Jajajaja bobo xddddddddd ❒ jajajjajajajaja,0
JAJAJAAJAJAJA Comida,0
iPod trigo Década trajiste Tranquila,0
burro terror terapeuta Tinder Salimos Ajajajajaja Callate JAJAJAJAJAJAJJAJAA JAJAJA bruto buzo peinado JAJAJAJ,0
#Hum Fíjate Sabés tijera presta PIZZA quítate Hago móviles Jajajja,0
tráigame peces Quiénes jajajja,0
bebo millonaria Jaimito JAJJJAJAAJAJAJAJJA #XD mordió Hulk tráigame pololear jajajj trigo presta,0
llamaré Póngase bebés JAJAJAJAJAJAJAJAJAJAJAJAJAJAJAJAJAJAJAJAJAJJA ballena =D ballena vagina Hablo ramita tropezó,0
escoba cumplido testigos,0
sapo,0
Hacemos solita computador JAJAJAJAJAJAJJAJAA Harlem,0
JAJAJAJJAJAJ nieto Abuela JAJAJAJAJAJAJAJAJAJAJAJAJAJAJAJAJAJAJA Perra,0
llámame velorio ácido cojo preferido apuesta telón aguantas regresó actor,0
chicles champú,0
burro bobo alcohólicos #JajaChistes Abrir,0
operación Vino prostitutas sentó xdddd Jajajajá Abrir buzo Querida,0
"jaimito .
. Awwww ajajaj preservativo",0
albañiles discutiendo Bond JAJAJAJAJAAJJA zoológico JAJAJAJAJAJAJAJAJAJAJA Trabajas JAJAJJAJAJAAJA JAJAJJAJAJA blancos parcialmente WiFi jjajajjajajajjajaja,0
Hablo Deme Jajajajajajaja ascensor toc sentarse Bruce,0
leones sacerdote apareció Taxi cortante cenizas marque JAJAJAJAJ adivinas JAJAJAJAJJAJA jajajaa caros felicito Titanic Napoleón,0
Supe obstáculos ofrezco jajajajajaj naranjas JAJAJAJAJJAJAJAJAJAJAJAJAJJAJAJAJAJAJAJAJAJAJAJAJAJA semáforo televisor responda ajjajaja xddddd Shake akdjajajaja Jajajajajajajajaja,0
canguro ramita CAGUÉ casaste Drácula lola amarillo agujero,0
teléfonos Cállate Gangnam arreglo sacaste tiré,0
JAJAJAJAAJAJJA,0
JAJAJAAJA jajajajajjajajajajaj AJAJJAJAJAJAJAJAJA llamaré JAJACHISTES prestas casados relleno atropelló #Anecdotas jajajajajjajajajajaj funeral,0
Tijeras camarero jajajajajajajajajajajajajajajajajajajaj Animal JAJAJAJAJAJAJAJAJAJAJAJAJAJAJA 365 tacaño tuvieras,0
televisor JAJAJA servilleta PIZZA Jajajajajajajajajajaajajajajaja flaquita,0
Auxilio flojo Galaxy velorio Hago mudo Rápido,0
ajajajja JAJAJAAJA compuesto maquillada Jajajajajajjajajajaja bebés zapato,0
whisky revisando . ... Auxilio llamaba arriesgado rayo Jajá Andrea Tierra Jajajjajajjaja casaste Cuándo,0
presta Quiénes callado descubrió ³ Hacemos paracaídas pollitos Deme buajajajajajaja,0
flota inodoro tos llamé cenizas PONCHES,0
CARA ardilla arreglo mudo JAJAJAAJA jardinero Jajajjajajjaja sabido olla,0
"Titanic cuéntale Dile Desea Shake Pene caníbal agujero tiraste ácido campanas .
. JÁJAJAJAJAJ",0
aparato confundido sentó CUÁL Jajajjajajjaja remedios,0
jajajajajajaja Pick felicito computadoras descubrió Vienes estómago @hadacon naranjas,0
Creces,0
JAJAJAJAJAJ Hablo Titanic Mickey llamarse JAJA iPad babor,0
Gym JAJAJAJAJAJ ajajaja fáciles meterlo Comida Jajajajajajajajajajajajajaja sandwich,0
Coca-Cola palomas cuelga rama echas Doc Jajajajajajajajajajaajajajajaja 365 sillas,0
Daña gritaron @JajaChistes Fea Neymar nieto JAJAJAJJAJAJ 1acto solita cubo Taxi Má JAJAJJAJAJA estufa laboral,0
secretaria Jajajajajajjajajajaja restaurante Querida campanas ‎,0
JAJAJAJAJAJA JAJAJAJAJA UY Tranquila,0
Cuelga WiFi Jajajajajajjajajajaja postre flaquita jajajajajajajajsjajajjasj baba,0
jajajaajajajajajaj íbamos ingeniero escribí JAJAJAJAJA fórmula Ayy,0
#FreeLoLa desordenada servir manco cadáver JAJAJAJAJAJAJAJAJAJAJAJAJ JAJAJAJAJAJAJAAJJAJAA JAJAJAAJA solita metí WiFi cortante,0
ahorro fíjate tartamudo,0
preferido encerrado llamó agotado AJAJAJAJAJAJAJAJAJAJA llevaban Jajajjaa apuesta,0
JAJAJAJASUELTENME tiré plátano,0
frenos gastas tiré gané sacaste gemelos @JajaChistes ajedrez,0
Recuerdas atropelló jajajsjaj Conoces #JuegosJajaChistes Lola jajajajaj Entienden #humortico nieto tenedor Eva terapeuta √ tenedor,0
defendiendo llevaban halloween #Anecd Camarero ajedrez jajahaa vegetariano halloween alcohólico Tranquila,0
Jajajajajajajaja flotan ahorro Chica cajas jajahaa Quiénes jajajajja bobo actor Pepito conocimos,0
#Cortitos ajjaja JAJAJAJAJAJAJAJAJAJAJAJAJAJAJAJAJAJAJAJAJAJAJAJAJAJAJAJAJAJAJAJAJAJAJAJAJAJAJ cobra Pedrito #Cortitos CORRAN metí ABUELO jajajajaaja recientes,0
Sra casan Harlem Rápido JAJAJAJAJAJAJAJAJAJAJAJAJAJAJAJAJAJAJA llevaron comillas adolescente adolescente Jajajajajajajajajajaajajajajaja,0
