text,score
reencarnación profesores Creces #Arenalol teléfonos alcohólicos Viagra remedios funcionar Disculpa,0
llevaban Habia zombie sentar JAJAJAJÁ,0
coges Testigos iPod,0
mudo,0
. ... lol Luna hablándole pajarito,0
jajajajajajajajsjajajjasj terapia cucarachas #Chiste compuesto nube condon AMIGOS prehistoria obstáculos,0
JAJAJAJAJAJAJA barrer #FrasesLocas Pepito responda halloween ajjajaja Loladrones JAJAJAJASUELTENMEAPENAS jajajajsjjjja Hablo durísimo JAJAJAJAJAJAJAJAJA camello,0
vendí bala JAJAJAAJAJAJA JAJAJAAJAJAJA Má JAJAJAJAJAJAJAJAJAJAJAJAJAJAJAJAJAJA 1acto JAJAJAJJAJAJ,0
llamaste prometes farmacia Recuerdas Supe Cállese Tienen ordenador caería HERMOSO Soldado PONCHES tigres,0
escoba Niñas operación Per bombillo Capitán xd conocimos Sufrir haha carpintero estatura AMIGOS Gym,0
@HADACON jajajajajajjajq gané harías,0
manzanas Cancelar Jajajajajajaja trajiste Per gané #Arenalol litros toc xd supo,0
JAJAJAAJ JaJaJa vidrio #Chiste diagnóstico anciana #XD terror apuesta pistola Escribiendo caería,0
OVNI ninfómana clitoris isla tardas llamaba bolita AMIGOS Andrea Ajajajajaja principal zombie Soldado,0
frutas reproducirte flotan ajajjajajaj jajaj dejá mudo,0
xdxd escribí Jajajajaajajajajajajajauajajaja XD Jajajaja computadoras Nemo cortante ordenador,0
enojaste gritaron canguro Thor LOL zapato pasame PIZZA,0
millonaria Thor JAAJAJA televisión pollitos operación llevaron,0
pajarito diagnóstico Deme diviJAJAJAJ Acuario,0
sencillos JAJAJAJAJA JAjajajajajajajajajajajajajajajajajajajaaja,0
amarillo Creces,0
Listo jajajajajaja bartender Hacemos Má,0
pistola estudias JAAJAJA rompecabezas Jajaj ♌ Jajajaja #ChisteMachista jajajjajajajaja Wikipedia tenedor Jajajajaajajajajajajajauajajaja,0
calentado xdddd #Chis @HADACON bizco #chistesmalos África jajajajaj caíste Lola #jajaja llevaban ovejas,0
pistola Awwww JAJAJAJJAJAJAJ blancos,0
pistola jajajja Conoces,0
cupido cajas escoba JAJAJJAJAJAAJA JAJAJAJAJAJAJAJAJAJ,0
jajaja cocodrilo LOLA Harlem zoológico buzo zapato CRISTOJAJAAJA Salvador Mickey Judas JAJAJAJAJAJAJAJAJAJAJAJAJAJAJAJAJÁ Disculpa JAJAJAJASUELTENMEAPENAS gravedad,0
Chapo confesarlo Pitbull leyenda jajajajajaja tiré Ajajajajaja televisión,0
oveja olvídalo zapato,0
bombillo nació CULO estatura LOLA jaula Terminator JAJAJAJAJAJAJA,0
Jajajá casaste comillas Recuerdas solita confesarlo Buajaja ratones,0
perezoso JJAJAJAJAAJJA autos iPod Jajajjaa durísimo SUPUTAMADRE Buajaja tortugas hablándole lol,0
ofrezco llamaba cinturón jajajajajja bizco @JajaChistes Trabajas Conclusión monjas casó caracol JAJAJAAJAJAJA llamaré discapacitados,0
estatura científicos AJAJJAJAJAJAJAJAJA autocorrector atropelló currículum Creces Habia sandwich menú colchones culpable Domino's Jaimito,0
jajaja análisis #FelizCumpleañosJajaChistes reproducirte sacerdote jardinero ‎ HERMOSO ajjajajaja JAJAJAJASUELTENME,0
vendí cubo camello JAJAJAJAJAJAJAJAJAJAJAJAJAJAJAJAJAJAJAJAJAJAAJAJAJAJAJAJAJAJAJAJAJA regresa psicólogos,0
prestas jajajajaaja computador Cariño jajajaj vitaminas Jajaj JAJAJAJJAJAJ SUEGRA ATTE jajajjaj,0
CRISTOJAJAAJA órganos regresa Ajajajajaja JAJAJAJAAY maquillada jajahaa Taxi Fíjate,0
JAJAJAJAJAJAJAJAJAJAJAJAJAJAJAJAJAJAJAJAJAJAJA babor #FelizCumpleañosJajaChistes obstáculos zapato ajajajja tirada JAJAJAJAJAJAJAJAJAJ JAjajajajajajajajajajajajajajajajajajajaaja ajjaja frutas colchones Napoleón,0
Cállese Creces mierdaJAJAJSKSJA JAJAJAJAJAJAJAJAJAJAJAJAJAJAJAJAJAJAJAJAJAJAJAJAAJAJAJAJAJA descubrió visa,0
xdddd JAJAJAJAJA @rrouvier sentar JAJAJAJAJAJAJAJAJAJAJAJAJAJAJAJAJAJA Estaban,0
Jajajajajajajajajajaja íbamos bipolar vegetariano ahorro vitaminas Ave remoto Hacemos Piensalo Estaban gemelos,0
árbol capitán funcionaba Compadre biblioteca #LOL Comida durísimo,0
llamarse astronauta Jajaj LOL Adelante √ Comida llola Animal monja AJAJAJAJAJAJAJ ajajaj planeado,0
casaste traía Coger recreo Ajajaja Cancelar jaula Trabajas Jajajajaja baba xDD funeral JAJAJAJAAJAJAJA Década,0
Jajajajja oveja Thor isla ardilla Joven astronautas Luna relleno,0
JAJAJJAJAJA lollapalooza Jajajajajajjajajajaja quítate Perra harías baterías Gay noooo jajahaa,0
mordió,0
#FrasesLocas Querida encerrado cayo,0
jajaja Auxilio tardas JAJAJJAJAJAAJA bipolar,0
gallina JAJAJAJAJAJAJAJAJAJAJAJAJAJAJAJAJAJAJAJAJAJAJAJAJAJAJAJAJAJAJAJAJAJAJAJAJJAJAJAJAJAJ menú capitán Ahahah JAJAJJAJAJA jajajajajjajajajajaj hipoteca funcionan JAJAJAJÁ,0
vidrio adolescente Compadre,0
virus Perra Lollapalooza manzanas haha clitoris matrimonio Contratado,0
pájaro 365 atropelló engaña solita LoL traga cortante millonaria,0
Creces xddddd #SuperligaOrangeLoL7,0
leggins tardas Jajajaja JAJAJAJJAJAJ champú Tome estatura Vino,0
bebes mozo lollapalooza terapeuta,0
Inicio Pato perezoso ji plátano,0
recreo Capitán Camarero culpable,0
peroJAJAJAJAA Conclusión Xd Aw hijita Acto JAJAJAAJAJAJA Tranquila compuesto jajajajajajajajsjajajjasj,0
#FelizCumpleañosJajaChistes jajajajjajaja Disculpa psicólogos gritaron,0
Tienen jajajajajajajajajajajajajaja JAJAAJAJAJAJAJAJAJAJA Neymar Pick cigüeña musicales Ave #JAJAJJA xDD traga JAJAJAJASUELTENME clitoris operación jajajá,0
Piensalo Pregúntale piojos bebes tropezó,0
Jajajajajajajajajajajajajajajajajajaja coges cuéntame cajas caramelos,0
=D JAJAJAJAJAJAJAJAJAJAJAJAJ #Anecd deme isla jajajajajajja Hulk jajaa Mirá toc JAJAJAJAJ,0
zapato cortante Entienden Chica autopsia caramelos 400 CULO Ajajajajaja,0
HIJO fáciles,0
JAJAJAJAJAJAJAJAJAJAJAJAJAJAJAJAJAJAJAJAJAJAAJAJAJAJAJAJAJAJAJAJAJA peinado JAJAJAJAJAJAJAJ ardilla quítate Condones Tome  Samsung Lógica LOLA astronautas Romeo GráficoJAJAJAJAJJA,0
JAJAJAJAJAJAJAJAJAJ Década JAJAJAJAJAJAJAJAJAJAJAJAJAJAJAJAJAJA zoológico Galaxy caníbal barrer #Anecd jjajajjajajajjajaja Wii nube,0
jjajajajajjajajajaja árabe tráigame JAJAJAAJAJAJA terror adolescente autos servirle científicos espermatozoide vagina gané aguantas JAJAJAJAJAJAJÁ sapo,0
África JAJJJAJAAJAJAJAJJA rayo marque Planet CARA casaron ajajajajaja,0
JAJAJAJAJAJAJAJAJAJAJAJAJAJAJAJAJAJA @JajaChistes magos JAJAJAJAJAJAJAJAJAJAJAJAJAJAJAJAJAJAJAJAJAJJA Superman JAjajajajajajajajajajajajajajajajajajajaaja probó nieto Capitán,0
pajarito repito casados cuelga jajajajajajja Niño JAJAJAJÁ coges caracol,0
llevaban Idea mmm Romeo bobo leyenda flota hipoteca gritas Salvador telón jajajjajajajaja escalera,0
tijera semáforo,0
móviles GráficoJAJAJAJAJJA meterlo Barney cuéntame Formas orgía,0
Animal gritaron HAHAHAH bolita Cariño Salimos Godzilla CARA desordenada albañiles Jajaja Chin xdddd,0
mataron haha diagnóstico ABUELO flojo flaquita ramita JAJAJAJAJAJAJAJAJAJAJAJAJAJAJAJAJAJA . ... Formas akdjajajaja íbamos JAJAJAJA,0
cogí WiFi CRISTOJAJAAJA JaJaJa JAJAJJAJAJAAJA dálmata Cariño,0
ajajajja #Hum jajajajajajja,0
vegetariano terapeuta automático Jajajajajajajajajajajajajaja JAjajajajajajajajajajajajajajajajajajajaaja Lollapalooza Barney íbamos Compadre jajajajajjajajajajaj jaimito CAGUÉ Pedrito,0
Soldado Agua JAJAJAJAJAJAJAJAJAJAJAJAJAJAJAJAJAJA JAJAJAJAJAJAJAAJJAJAA Soldado LOLLA JAJAJAJAAJAJJAJ Jajaja JAJAJAJAJAAJJA Batman flojo pololear,0
tratamiento semáforo jaula íbamos tenis responda hijita palomas rompecabezas Entienden,0
. . terror anciana remoto Idea tijera baterías servirle,0
jajaa coff llamé Póngase JAJAJAA Pene manzanas #SuperligaOrangeLoL7 Ajajajajaja traducir JÁ,0
@hadacon 5000 responda Ahahah Chica,0
JAJAJAJAJAJAJJAJA tráigame ajajajajaja Maestra zoológico jajajajajja Hija JAJAJAJAJAJAJAJAJAJAJAJAJAJAJAJAJAJAJAJAJAJAJA regresó JAJJJAJAAJAJAJAJJA flojo,0
apareció Toc científico autos,0
Idiota virginidad jajaa JAJAJAJAJAJAJAJAJA Querida Estaban álgebra,0
365 LIKES jajajajja Jajajajaja olvídalo JAJAJAJAJAJAJAJAJAJAJAJAJAJAJAJAJAJAJAJAJAJAJAJAJA velorio SOLA Aw jajajajajajajajaja echas noooo Salud,0
"estallaJAJAJA Bruce japonés quítate tigres Má frutas .
. llola Soldado ♌ Barney Pato ratones quemó",0
POLICÍA @rrouvier jajajajajajjajq quitó principal JAJAJAJAJAJAJAJAJAJAJAJAJ JAJAJAJAJAAJJA jajahaa biblioteca Hahaha autocorrector Capitán sorprendido @chistegenialxd pollito,0
telón ajjajajaja rama,0
Entienden toc _ʃʃ jajajajajajajajaja  Pafuera jjajajajajjajajajaja,0
gastos rama echas #Humor Tierra JAJAJA restaurante dirías JAJAJASUELTENME prestas,0
escalera Tienen Callate flaquita Viagra llamaba telón Gangnam #FelizCumpleañosJajaChistes JAJAJAJJAJA semáforo pegan,0
Tijeras hacés coff llamaste calculadora farmacia Ahahah pollito sorprendido,0
mozo tuvieras caníbal finalmente juguete bruto quemó,0
jajjajaja Mijo bizco Taxi Viste oveja Recuerdas JAJÁ JAJAJAJAJAJASUELTENME jabón cigarros Viejo llamé,0
LOL JAJAJAJAJ servirle,0
Habia Jajajajajajajaja JAJAJAJJAJAJ caíste ELIJO JAJAJAJAJAJAAJJAJAAAJ CULO CRISTOJAJAAJA Barney mozo prostitutas Gay respondió JAJAJAJAJAJAJAJAJAJAJAJAJAJAJAJAJAJAJAJAJAJJA,0
Camarero Eva rompecabezas Batman,0
jajajajajja parcialmente lloró lolaso ardilla Querida,0
rayo tuvieras probado autocorrector foca Piensalo buajajajajajaja ballena 1acto traía Naces,0
Ajajajajaja CORRAN caería Cuáles Jajajajajajjajajajaja cogí jajajajajjajajajajaj postre HIJO prehistoria funcionan hijito JAJAJAJAJAJAJ JJAJAJAJAAJJA JAJAJAJJAJAJA,0
Úselo parcialmente . . JAJAJAJAJAJANo bobo Jajajjajajjaja #FelizCumpleañosJajaChistes cubo JAJAJAJAJAJAJAJAJAJAJAJAJAJAJAJAJAJAJAJAJAJAJAJAJAJAJAJAJAJAJAJAJAJAJAJAJJAJAJAJAJAJ 2acto Chapo mmm biblioteca AJAJJAJAJAJAJAJAJA JAJAJAJAJAJ,0
tirada Década,0
serías alumno diagnóstico escoba ajajajajaja Viste JAJAJAJASUELTENMEAPENAS zoológico conocimos ordenador gritó ajjaja,0
marque,0
toc colchones sordo Hablo ratero ESE secretaria Narnia Príncipe Jajajajajajajajajajajajajaja mecánico CRISTOJAJAAJA estufa #JAJAJA martillo,0
hazme Viagra,0
postre Señorita ATTE #JuegosJajaChistes Alzheimer _ʃʃ zapato alteré,0
blancos Pato Jaja trajiste descubrí llevaron LIKES Jajajja transformer tenis Eva Doc trajiste diseñador,0
Escribiendo vasito responda Sufrir defendiendo pestañas Muere ordenadores vitaminas íbamos 4x4,0
ajajajaj JAJAvsiamlAñobgrfnkJAJAJA CUÁL,0
Ajjajaajajaja jajajaa felicito jajjajaja UY lollapalooza colchones economía,0
Jajajajajajaja Jajajjajajjaja monja callado Terminator JAJAJAJAAJJAJAJAJAJAJA jajajajajajaja virus perezoso alcoholismo,0
Muere xddddd escoba Thomas noooo cadáver,0
Buajaja llámame confundido maquillada jajajja comillas aparato relleno hablándole enojaste casaron autocorrector Perdone Genial,0
álgebra llamé principal nublado Tome JAJAJJAJAJA xddddd visa Jajajajaj Jajajá besito JAJAJAJAJAJAJAJAJAJAJAJAJAJA JAJJJAJAAJAJAJAJJA Jelipe,0
aguantas cucarachas LOLLA traducir adoptado Naces Idea Ajjajaajajaja JAJAJAJAJJAJA  deme Xd,0
baterías litros @hadacon Inmaduro JAJAJAJAJAJAJAJAJAJAJAJAJ 4x4 Viagra Capitán JAJAJAJJAJAJAJ fáciles,0
besito Perfil Jajajajajajajaj WiFi dejaré Jaimito Chiste,0
Rápido enojaste,0
Bond Adelante Fea virginidad confieso Póngase flotan ninfómana JAJAJAJAJAJ,0
Tranquila computadoras caería JAJAJAJAAJJAJAJAJAJAJA Pick HAHAHAHA SUPUTAMADRE terapeuta,0
JAJAJAJAJAJAJA Jajajajajajajajaja SOLA respondió millonaria meterlo Doc autopsia xdd,0
jajajjaj Soltero JAJJJAJAAJAJAJAJJA Pafuera tortugas profesores,0
"Animal Mijo matrimonio científico gallina Entienden .
. Quiénes Jajajajajajajajaja regresó ― vidrio conocimos",0
JAJAJAJAAJAJJAJ Pitbull Ahahah Má Viagra currículum felicito,0
diviJAJAJAJ escala nube caracol AJAJJAJAJAJAJAJAJA,0
Conclusión celulares,0
AMIGOS ordenador Inglés Bestia Ahahah JAJA JAJAJAJAAJAJJAJ CUÁL supuesto tirada Joven,0
"leones agujero dejaré Neymar Salimos .
.",0
Querida ingeniero #Anecdotas relleno ajajajaj supuesto análisis sentó llamó durísimo,0
2050 platicar JAJJAJAJAJAJAJAA Sufrir funcionar toro CARA,0
Viste @JajaChistes JAJAJAJAAY íbamos condon JAJAJAJJAJAA,0
peroJAJAJAJAA gluglu confieso teléfonos objeto jajajajajajaja #Hahaween ingeniero Juana probado xD,0
Jajajajjaja JAJAJAJAAJJAJAJAJAJAJA pon JAJAJAJAJJAJA óptica AJAJAJAJAJAJAJ tenían clitoris CAGUÉ diseñador matrimonio casaste JAJAJAJAJAJAJAJ jjajajjajajajjajaja 2050,0
Testigos JAJJJAJAAJAJAJAJJA Jajajajajajjajajajaja,0
JAAJAJA Judas JAJAJAJAJAJAJAJÁ Inicio computadoras culpable JAJAJAJAAJAJJA Juana Mijo,0
Jajajahaa pajarito AMIGOS supuesto jajaa jajajajajajaj defendiendo nieto aplausos Entienden JAJAJAJAAJAJJAJ jajajá millonaria jjajajjajajajjajaja flojo,0
finalmente Condones Domino's Inmaduro Salimos Doc volvieron apuesta óptica JAJAJAJAJAJ Entienden JAjajajajajajajajajajajajajajajajajajajaaja,0
GráficoJAJAJAJAJJA caería ABUELO mataron champú nublado quemó toro casaste █ Shake xdddd,0
JAJAJAJJAJAJAJ sillas jajajaa podía JAJAJJAJAJA LOLLA ajajajaja ingeniero JAJAJAJAJAJAJÁ 400 supo Samsung jajajajajajjajq manzanas JAJA,0
Hija buajajajajajaja cigüeña,0
HAHAHAHA diviJAJAJAJ curvas bipolar JAJAJAJAJAJAJAJAJAJAJAJAJAJAJAJAJAJAJAJAJAJAJAJAJAJAJAJAJAJAJAJAJAJAJAJAJAJAJ bañando,0
Jajaj Príncipe dejá JAJAJAJA jajajajajajajajsjajajjasj vegetariano,0
Testigos blancos Jajajajajajajaja supuesto Alcohol cadáver,0
Niño jajajajajajaja Cuelga casados Hacemos Adelante,0
JAJAJAJAJÁ camarero,0
clitoris JAJAJAJAJAJAJAJAJAJAJAJAJAJAJAJAJAJAJAJAJAJAAJAJAJAJAJAJAJAJAJAJAJA #Arenalol ⇆ Ahahah Dile sacerdote chango #LOL,0
JAJAJAJAJAJASUELTENME calculadora cuéntame Estaban JAJAJAJAJAJAJAJAJAJAJAJAJAJAJAJAJÁ Jajajajajajajajajajaja alcohólicos espermatozoide defendiendo Coger ninfómana #JuegosJajaChistes,0
fíjate Recuerdas,0
Jajajjajajjaja babor #JAJAJJA jajajajajajaj,0
arreglo 2acto JAJAJAJAJAJAJAJAJAJAJA tigres orgía vendedor dálmata jajajaajajajajajaj ahorro Jajajajja agotado,0
"jajajaj jajajajajaja JAJAJAJAJAJAJAJAJAJAJAJAJ supuesto descubrí manzanas peinado Fíjate .
. Thor chango =D vegetariano",0
JAJAJAJASUELTENME hijito Trabajas 5000 virus #SuperligaOrangeLoL7 Taxi apareció sentarse adivinas mierdaJAJAJSKSJA,0
funcionar isla Jajajjaa,0
litros Creces oveja rayo 2acto baba jajaj vasito confieso JAJACHISTES Jajá SOLA,0
"jabón Dígame Godzilla ajedrez presta Harlem copiando colchones Aw Jajajajajajajajajajajajajaja JAJAJAJAJAJAJJAJAA estufa .
. Jajajajajajajaja",0
vasito,0
tsunami #JuegosJajaChistes ginecólogo escoba Niñas Neymar Jajaja lolla Idiota despiden televisión jajajajajjajajajajaj bala Romeo terapeuta,0
Cállate Callate frenos JAJAJAJJAJAJAJ enchufe Soltero Batman camarero @HADACON Segura computadoras Cállate Eva #JAJAJÁ,0
jajajajajajaja cajas JAJAJAJAJAJA Jajajajajá hijito superficie virus #4toCumpleañosJajaChistes funcionaba Camarero #FrasesLocas podía jajajajajajaja JAJAJAJAJAJAJAJAJAJAJAJAJAJA,0
Querida #jajaja velas JAJAJAJAJAJAJAJAJA carpintero,0
Taxi jajajsjaj Auxilio Pitbull cogí bartender #Cortitos crece repito cortaron confieso UY paracaídas manzanas,0
jajajajajjajajajajaj enojaste ELIJO naranjas JAJA Pase árbol confieso recreo,0
bizco Má martillo Hija autopsia JaJaJa,0
crudo JAJAJAJAJAJAJAJAJAJAJAJAJAJAJAJAJAJAJAJAJAJAJAJAJAJAJAJAJAJAJAJAJAJA JAJAAJAJAJAJAJAJAJAJA AJJJJAJJAJAJAJJA árbol Desea cojo,0
cinturón tardas discapacitados JAJAJASUELTENME finalmente,0
#JAJAJJA JAjajajajajajajajajajajajajajajajajajajaaja Lola Animal,0
sapo ballena JAJAJAJJAA capitán Agua JAJAJAJAJAJAJAJAJA ⇆ Gallina laboral Piensalo jajajaj,0
Compadre @CamilaTuDiosaxD JAJAJAJAJA aparato #Humor gritas Lollapalooza flota,0
zombie McDonalds jajajaa JAJAJAJJAJAA supuesto regresa,0
Condones #FreeLoLa bebes apuesta @CamilaTuDiosaxD conducir jaula Awwww Idiota,0
musicales,0
Página fáciles callado Chin grité Acto peces Batman sillas Duermo █ JAJAJAJJAJAJ bobo Jajajajajajajaj,0
isla,0
ascensor pololo,0
obsesionada Terminator CO cigarros JAJAJAJAJAJAJAJAJAJAJAJAJAJAJAJAJÁ Tranquila Úselo @HADACON JAJAJAJAJAJAA taxista,0
Joven Creces adoptado testigos callado rayo JAJAJAJAJAJ,0
científicos Taxi Xd 4x4 farmacia Aw,0
@chistegenialxd juguete Callate JAJAJAJAJAJÁ peinado burro #JuegosJajaChistes alcohólico,0
prostitutas rió,0
_ʃʃ olla Segura Señorita Gangnam dirías platicar perezoso Segura,0
vendedor Cállese manzanas Agua Terminamos Príncipe JAJAJJAJAJAAJA confundido Deme,0
xdd mataron ofrezco pollito Recuerdas Inicio Señorita Polo Entienden,0
bruto serpiente,0
JAJAJJAJAJAAJA terapia bebida Chin,0
Mire Harlem japonés JAJAJAJJAA,0
ofrezco Jajajá letrero televisión oveja besito Piensalo cuchillo sandwich cojo,0
#JuegosJajaChistes cenizas . ... enchufe Jajajajajajjajajajaja Polo llola confesarlo jajajajajajja xdddddd Empieza diseñador xD,0
pollito cumplido HIJO Jajajajá #JAJAJÁ terror,0
piojos,0
apuesta JAJAJAJAJAJAJA xdddddd móviles Gallina apareció gané Andrea bobo Wikipedia mozo móviles jajajja #jajaja,0
#Anecdotas vendrá cuchillo echas,0
prehistoria postre jajajajaaja JAJAJAJAJAJAJAJ Inicio mecánico quemó Inglés jjajajajajjajajajaja JAJAJAJAJAJASUELTENME zoológico JAJAJAJAJAJAJAJAJAJAJAJAJAJAJAJAJAJAJAJAJAJAJAJAJAJAJAJAJAJAJAJAJAJAJAJAJJAJAJAJAJAJ caracol Hacemos,0
LIKES tacaño flaquita remoto llevaban sardina Lógica subiste,0
Camarero confieso testigos Jajajjajajjaja remoto jajajaja Buajaja ajajajja Idiota japonés vagina asustado JAJAJAJAJAJAJAJAJAJAJAJAJAJAJAJAJAJAJAJAJAJAJAJAAJAJAJAJAJA,0
preservativo Querida jajaj Empieza Jajajajajá Jelipe telón JAJSJAJAJAJAJA despiden arreglo,0
espacial Desea JAJAJAJAJAJAJAAJJAJAA 400 profesores JAJAJAJAAJAJJAJ Tranquila,0
operación despiden caería Luna jaja bebes CARA blancos peces,0
hada bebo bolita Piensalo Habia Genial hacés JAJÁ,0
tigres japonés gastos Pepito HIJO @rrouvier caramelos pestañas,0
tigres √ Auxilio Hago JAJAvsiamlAñobgrfnkJAJAJA ajajajja Cuándo superficie trasero chango,0
Disculpa Agua JAJAJAJJAJAA Aw felicito bebes JAJAJAJAJAJAJAJAJAJAJAJAJAJAJAJAJAJAJAJAJAJAJA,0
vegetariano gritas diseñador Cancelar caros jajajajjajaja jajajajajjajajajajaj solita Coca-Cola plátano aparato McDonalds Buajaja,0
tardas inodoro jajajajajajaja Cállate,0
jajajjaj albañiles Bruce Cállese 1acto planeado Jajajajajajjajajajaja apuesta callado casados bruto #Anecd JAJAJAAJA,0
Romeo prostitutas jajajajajaja baba objeto #JuegosJajaChistes Príncipe traía cigüeña pestañas Juana JAJAJAAJA conejo,0
casaron Ajjajaajajaja,0
Pitbull estufa,0
quemó Listo Muere Tienen toc GráficoJAJAJAJAJJA tiraste Hahaha #Arenalol engaña,0
toc Sra Wii 400 confesarlo sencillos obstáculos LOLLA LoL cojo estómago Tantos fórmula Disculpa,0
bebida autopsia,0
JAJAJAJAJJAJAJAJAJAJAJAJAJJAJAJAJAJAJAJAJAJAJAJAJAJA cinturón CAGUÉ #Hahaween flota mecánico monjas,0
Compadre Samsung Cariño,0
ajajajajja Idea Tantos televisor,0
Jajaja █ millonaria,0
manco Ahahah Salvador bañando pasame Viejo JAJAJAJAJAJAJAJAJAJAJAJAJAJAJAJAJAJAJA,0
#xD Capitán traga PONCHES jajajajajaj trajiste árbol descubrió óptica,0
bolígrafo,0
probó olla repito Loladrones Wii,0
ajaja sorprendido JAJAJAJAJAJAJAJ científico Entendieron jjajajjajajajjajaja Ayy coges jajajajajajja,0
Hacemos Creces Ave Aw sentar prostitutas,0
adivinas sabido moscas foca higiénico tortugas tratamiento,0
"zoológico Tome Bruce fáciles .
. llamaría",0
encerrado servilleta meterlo JAJSJAJAJAJAJA,0
jajjajaja CO JAjajajajajajajajajajajajajajajajajajajaaja Formas JAJAJAAJAJAJA Jajajajá Soltero ji paracaídas ajajaj,0
JAJAJAJAJAJAAJJAJAAAJ felicito llevaban AJAJJAJAJAJAJAJAJA sencillos ajajajja álgebra,0
jajajajajajaja cuchillo aplausos curvas anciana presta JAJAJAJAAJAJJA,0
Sufrir,0
Conclusión nublado Jajajajaj akdjajajaja nublado xD Vino Sufrir pepito musicales llamaba,0
leyenda bruto Buajaja DiCaprio JAJAJAJAJAJAJAJAJAJAJAJAJAJAJAJAJAJAJAJAJAJAJAJAJAJAJAJAJAJAJAJAJAJAJAJAJAJAJ jajaa mudo sordo Chin JAAJAJA,0
bolígrafo JAJAJAJAJAJAJAJAJAJ televisor Juana prometes JAJAJAJ vagina,0
JAJAJAJA JAJAJAJAAJJAJAJAJAJAJA Hablo incorrecta,0
JAJAJAJAJAJAJAJAJAJAJAJAJAJAJA diseñador HERMOSO 4x4 Nemo ♌ pistola calentado bobo,0
JAJAJAJAAY nació jajajajajajjajq alcohólico sabido bruto AJAJJAJAJAJAJAJAJA Disculpa Napoleón,0
sordo japonés prepare lollapalooza ballena transformer xd ❒ #JAJAJÁ NOO JAJAJAJAJAJAJAJAJAJAJAJAJAJAJA Napoleón,0
hipoteca bipolar parcialmente JAJAJAJAJAJÁ Escribiendo,0
colchones cadáver jajajajajja encerrado terapeuta,0
madrina Fea ajajajajaja terapia visa JAjajajajajajajajajajajajajajajajajajajaaja JAJAJÁ Agua JAJAJAJAJAJANo,0
gastas piojos Napoleón JAJAJAJAJAJAJAJ lolaso orgía blancos JAJAJAJAJAJAJJAJA xdd,0
speak foca llamé 2050 funcionan Fea Úselo desordenada repito Ave ahorro Jajaj Coger arriesgado jajajjaj,0
tigres secretaria JAJAJJAJAJAAJA Salvador jajajaa testigos millonaria Deme . . coff,0
ofrezco Má CULO JAJAJAJAJAJAJAJAJAJAJAJAJAJAJAJAJAJAJAJAJAJJA jajajajja Eva crudo,0
cortaron jajajajja volvieron Gym Abrir teléfonos higiénico,0
Inmaduro nave recreo Jajajajja JAJAJAAJ japonés capitán pepito isla Jajajajajajajajajajaja Disculpa tratamiento buajajajajajaja xdxd,0
culpable Jajajajajajajaj revisando #Arenalol llamaba supuesto cubo repito barrer confesarlo Ray JAJAJAJAJAJAJAJAJAJAJAJAJAJAJAJAJAJAJAJAJAJAJAJAJAJAJAJAJAJAJAJAJAJA Chin pasame JAJAJAJAJAJAJAJÁ,0
álgebra baba Taxi ginecólogo JAJAJAJAJAJAAJJAJAAAJ palomas jajajajajjajajajajaj esposas,0
condon JAJAJAJAJAJAJAJAJAJAJAJAJAJAJAJAJAJAJA HAHAHAHAHH marque servirle Piensalo cigüeña durísimo peinado fórmula ABUELO,0
JAJAJAJAJAJASUELTENME bala Póngase seco arreglo xdd,0
trigo cajas íbamos Thor _ʃʃ planeado,0
repito bebo 2050 #4toCumpleañosJajaChistes gemelos psicólogos íbamos #SuperligaOrangeLoL7 laboral terapeuta vasito clitoris Tinder,0
reuniones servirle ajajajajja JAJAJAJAJAJAJAJAJAJA hipoteca ji jjajajjajajajjajaja arrastrándose,0
estómago jaja ATTE casaron Traduzca ‎ flota,0
cabezas jajjajaja mierdaJAJAJSKSJA,0
bobo colchones echas Godzilla jajajajjajaja jajajajajajaja Jajajajá engaña,0
zapato Testigos alcoholismo JAJACHISTES jabón,0
Jajajja Salud #Humor felicito ingeniero pollitos Coger pepito caramelos,0
prehistoria Dile JAJAJAJAJAAJJA Habia Jajaja tartamudo ELIJO nublado bipolar visa,0
JAJAJAJAJAJAJAJAJAJAJAJAJAJAJA Buajaja 365 celulares JAJAJAJAJAJAJAJAJAJA JAJAJAJA barrer caros hahaha Taxi,0
Jajajaja bebes científico Andrea,0
zoológico tiré llamé supuesto árbol Jajajajajajajaja,0
mataron Jajá peinado Década LOL Aw Jajajajajajjajajajaja,0
cubo ajajajajaja caería ajedrez Soldado #xD,0
Titanic jjajajjajajajjajaja,0
Newton hazme cinturón manco agotado mataron jabón Lógica JAJAJAJAJAJAJJAJAA,0
Póngase SUPUTAMADRE #Cortitos,0
POLICÍA Conoces Perra Contratado JAJAJAAJAJAJA llamaré traga dirías,0
actor jajahaa campanas halloween litros sapo champú,0
dálmata,0
JAJAJAJAJAJAJAJAJAJAJAJAJAJAJAJAJAJAJAJAJAJAJAJAJA Mijo,0
#FrasesLocas babor vagina pasame Muere funcionar patos mago ⇆ Vienes manzanas Aw magos prehistoria operación,0
servilleta JÁ Póngase peluquería Segura Drácula baba sandwich Genial secretaria Galaxy presta Terminamos ratero,0
tenedor alcoholismo discapacitados terapia Hija ♌ Cállese buajajajajajaja íbamos revisando Escucha tortugas peluquería POLICÍA,0
JAJAJAJAJAJAJAJAJAJAJAJAJAJA ordenadores Thomas Agua Wii dejaré Conoces ³ leggins POLICÍA Perdone dejá JAJAJAJAJAJAJAJAJAJAJAJAJAJAJAJAJAJAJAJAJAJAJAJAJAJAJAJAJAJAJAJAJAJA íbamos ,0
Hablo zapato JAJAJAJAJAJAJAJAJAJAJAJAJAJA,0
#Cortitos hijito pololear Entendieron Sagua'aJAJAJA #FrasesLocas jajajajsjjjja xd oveja camello AJJJJAJJAJAJAJJA JAJAJAJAJAJASUELTENME conocimos,0
terapeuta JAJAJAJAJAJAJAAJJAJAA Sra vendrá Traduzca Batman LOL Hulk encerrado trajiste,0
espermatozoide prostitutas cojo JAJAJAJAJAJAJAJAJA,0
tratamiento ‎ Habia Cállese,0
Empieza llamarse agotado Inicio JAJAJAJAJAJAJÁ confieso lolaso #LOL recreo,0
JAJAJAJAJAJAJJAJA coges JAJAJAJAJAJAA Cariño volvieron traficante durísimo Domino's,0
ajajajaja secretaria Lógica Alcohol metí Jajajajajaja bizco JAJAJAJAJAJAJAJAJAJA two Empieza,0
funcionar musicales veterinario remedios traga carpintero @CamilaTuDiosaxD JAJAJAJAJ Jajaj profesores AJJJJAJJAJAJAJJA Chapo Jajajajaja terapia,0
Viste Gay Perdone Pikachu dirías monja ajajajajja Jajajajajajajajajajaajajajajaja jajajajjajaja Pikachu Escucha 1acto,0
sandwich JAJAJAJAJAJAJJAJA Jajajajajajajajajajaja laboral callado alteré currículum Chapo psicólogos,0
dejá mmm JAJAJAJAJAJ cuéntale menú Jajajajajajajajajajaja,0
jajajajajja JAJAJAJAJAJAJAJAJAJAJAJAJAJAJAJAJAJAJAJAJAJAJAJAJAJAJAJAJAJAJAJAJAJAJAJAJJAJAJAJAJAJ objeto ajajajja Camarero,0
quemó HAHAHAHA 1acto jajajajaja estudias HAHAHAHAHH defendiendo Perfil asustado Chin pepito velorio,0
JÁJAJAJAJAJ llamaste colchones metí recientes,0
defendiendo jajajá Animal obstáculos Ahahah,0
biblioteca,0
escoba HAHAHAHAHH,0
jabón Niñas,0
Pase ramita piojo astronauta apareció callado,0
llamó adivinas Jaimito óptica diviJAJAJAJ operación Estaban Joven,0
tráigame economía vagina caros volvieron,0
JAJAJAJAJJAJAJAJAJAJAJAJAJJAJAJAJAJAJAJAJAJAJAJAJAJA ajjaja JAJAJAJAJAJAJAJAJAJAJAJAJAJAJAJAJAJAJAJAJAJJA testigos JAJAJAJAJAJAJAJAJAJAJAJAJAJAJA ♌ vasito cenizas JAJAJAJAJAJAJAAJJAJAA #xD,0
alcoholismo JAJAJJAJAJAAJA Jajajajajajajaj marque Fíjate logré Gallina vagina espacial esposas Comida,0
#Anecd Tinder JAJAJAJAAJJAJAJAJAJAJA DiCaprio dejá presentó campanas prestas automático ATTE JAJAJAJAJ Jajajahaa HAHAHAHA CARA ginecólogo,0
funeral ordenador mierdaJAJAJSKSJA JAJAJAJAJAJAJAJAJAJA JAJAJAJJAJAJAJ serpiente Batman HAHAHAHA caníbal deme,0
JÁ LOL Habia ajajajajja jajajajajajajajajajajajajajajajajajajaj Jajajjajajjaja _ʃʃ vendrá,0
magos @rrouvier Testigos astronauta rayo Jajajajajajajaj #JAJAJJA aparato currículum,0
noooo canguro arrastrándose AJJJJAJJAJAJAJJA JAJÁ ajajajajja sentó tacaño conocimos Página manzanas @chistegenialxd ‎ 2y,0
"Quiénes JAJAJAJAJAJAJAJ jajjajaja Hija .
. llámame Pase ingeniero piojos llevaban Pato",0
Alzheimer llamé masturbación JAJAJAJAJAJAJAJAJAJAJAJAJAJAJAJAJAJAJAJAJAJAJAJAJA sencillos aguantas JAJAJJAJAJA computadoras,0
