text,score
deme descubrió,0
JAJAJÁ Toc Habia Soltero #JAJAJA,0
ácido servilleta regresa cucarachas,0
virus LOLLA aplausos ❒ Dígame Sagua'aJAJAJA Traduzca Planet Querida Jajajahaa CO amarillo,0
jajajjajajajaja tenían Jajajahaa durísimo JAJAJAJAJAJAJAAJJAJAA descubrió iPod,0
obstáculos viagra Excepto televisión tenían Condones regresó mago,0
llamaría DiCaprio encerrado Judas JAJAJAJAJAJAJAJAJAJAJAJAJAJAJAJAJAJAJAJAJAJAJA hablándole baba casaron Chiste Jajajajaja estudias,0
computador postre Muere TOC monjas,0
estufa hahaha ³ JAJAJAJJAJAJAJ defendiendo Cuáles operación Listo Década,0
bolígrafo vendedor funcionaba AJAJJAJAJAJAJAJAJA Harlem Jajajjaa monjas aguantas Conclusión WiFi lolla Per Jajajajajajaja dirías naranjas,0
tenían japonés CULO chicles coges Úselo virus Ahahah ‎ deme Chiste,0
Cuáles JAJAJAJAJAJA óptica Sarahaha echas whisky Joven #FrasesLocas ❒,0
ajajajajajaajaj 2acto jajajajsjjjja reuniones Ajjajaajajaja cortaron Pene jajajajjajaja jajajj Deme,0
Pick descubrí compuesto jajajsjaj responda chicles ajajajaja Cancelar matrimonio #humortico Compadre sacerdote jajajajajja musicales apuesta,0
JAJAJAJAJAJAJAJ jaja Galaxy bebida Toc xddddd,0
Abrir cuelga,0
capitán Coger Fíjate cinturón supo calculadora plátano,0
JAJAJAJAJAJAJAJÁ ordenador @chistegenialxd campanas tos cabezas planta sencillos,0
Duermo lolla probó análisis JAJAJAJAAJAJAJA gritas xdxd jjajajjajajajjajaja aparato prostitutas telón Habia,0
CULO vasito @chistegenialxd Auxilio LOL traficante xDD sacerdote cigarros llamaste ‎ Deme funeral,0
llamarse JAJJAJAJAJAJAJAA curvas llola ABUELO África,0
hada JAJSJAJAJAJAJA operación gritas,0
Dígame Taxi Creces profesores Testigos Titanic Lógica McDonalds jajajajaj dirías nave HAHAHAHAHH tacaño,0
ingeniero AJAJJAJAJAJAJAJAJA traducir Animal JAJAJAJAJAJAJAJ baba lol Viejo sentarse JAJAJAJÁ #Anecdotas Ayy Jajaja,0
adoptado diagnóstico Juana vidrio Fíjate estatura alcoholismo █ virus Jajajajá casó arrastrándose finalmente órganos,0
escala #JAJAJA pololo ajajajajaja HAHAHAHAHH clitoris Perdone escribí Daña JAJAJAAJ,0
caería Deme ajajaj akdjajajaja #FelizCumpleañosJajaChistes JAJAJAJAJAJAJAJAJAJAJAJAJAJAJAJAJAJAJAJAJAJAJAJAJAJAJAJAJAJAJAJAJAJA jajajajaja,0
tinta JaJaJa velas Muere jajaja Cancelar Perdone OVNI tirada Chiste xdxd JAJAJAJAJAJAJAJAJAJAJAJAJ jardinero Pafuera,0
JAJAJAJASUELTENME velas foca ELIJO Adivina Camarero llamarse @hadacon Xd sacaste apareció iPod incorrecta ABUELO órganos,0
diseñador JAJAJAJAJAJAJAJAJAJAJAJAJAJAJA currículum llamé mierdaJAJAJSKSJA JaJaJa vasito JAJAJAJA piojo JAJAJAJAJAJAJAJAJAJAJAJAJAJAJAJAJAJAJAJAJAJAJA Daña ajjaja jajaja pepito,0
bebes trasero escalera,0
Piensalo JAJAJAJAJAJAJAJAJAJAJAJAJAJAJAJAJAJAJAJAJAJJA McDonalds tiposJAJAJA tráigame subiste,0
Fíjate JAJAJAJAJAJAJAJAJAJAJAJAJAJAJAJAJAJA,0
deme Viagra Pase JAJAJAJASUELTENMEAPENAS Jajaj Fea Tome Sabés Soldado Nemo mago xDD llamarse jjajajajajjajajajaja Chapo,0
LOL Narnia estatura Niñas Cuándo frenos foca cigarros ordenadores Newton farmacia toc JaJaJa bolita flotan,0
trigo Perdone Doc objeto,0
Awwww jajajajajaja JAJJAJAJAJAJAJAA veterinario JAJAJJAJAJAAJA,0
móviles _ʃʃ computador volvieron Jajajajajajaja XD regresó bebo objeto JAJAJAJAJAJAJAJAJAJAJAJAJAJAJA quítate,0
#chistesmalos foca . ... ajaja #JAJAJA Formas funcionan farmacia Thomas #Anecdotas Estaban japonés ajedrez,0
Newton bebés McDonalds JAJAJAJAJAJAJAJAJAJAJAJAJAJA reuniones discutiendo Abraham iPod,0
JAJJJAJAAJAJAJAJJA jajajjajajajaja vagina marque volvieron piojo HIJO Sarahaha prostitutas servir JAJAJAJAAJAJJA higiénico estómago,0
pepito sordo estufa Viagra LIKES Andrea higiénico LOLA,0
jajjajaja █ ramita Cuáles blancos ninfómana pájaro,0
Sagua'aJAJAJA psicólogos Pase Príncipe 2acto Segura arriesgado anciana órganos Duermo terapia,0
― JAJAJAJJAJAJ fáciles reuniones ESE ESE besito Soldado letrero NOO Idiota casó,0
jajajj serías leones JAJAJAJAJAJAJAJAJAJAJAJAJAJA Condones JAJAJAJJAJAJ fórmula quemó jajajajajajajajsjajajjasj JAJAJAJAJAJAJAJAJAJAJAJAJAJAJAJAJAJAJAJAJAJAJA Jajajajajajajajaja,0
patos #Arenalol callado JAJAJAJAJAJAJAJAJAJAJAJAJAJAJAJAJAJAJAJAJAJAJAJAJAJAJAJAJAJAJAJAJAJAJAJAJAJAJ #Hahaween chango psicólogos gastos,0
rama fíjate Niñas Luna JAJAJAJ,0
Titanic tenedor obsesionada gané traficante Bestia ordenador gritó jajajaa,0
"encerrado Cállate Tijeras gallina funcionaba JAJAJAJJAJAJAJ Condones jajajaj Inmaduro Jaja Má Galaxy copiando .
.",0
Bruce Sagua'aJAJAJA martillo ajajjajajaj atropelló Jajajajajajjajajajaja JAJAJAJAAJAJAJA JAJAJAJAJAJAJAJAJAJAJAJAJAJAJA,0
SOLA cuchillo tenis JAJAJAJA Adelante superficie Naces chango Tinder cupido,0
tacaño llola jajajaa Hija #JAJAJJA Coca-Cola caracol JAJAJAJAJAJAJAJAJAJAJAJAJAJA caros tos,0
engaña JAJAJAJAJAJAJJAJAA Jajajá JAJAJAJAJAJÁ Idea ajajajajaja agujero Jajajajaajajajajajajajauajajaja Tienen nave prostituta,0
Style dirías Perdone zapato automático Jajajajajajajajajajajajajaja Jajajajá LoL,0
JAJAJAJAJAJAJ Perfil CUÁL,0
JAJAJAJAJAJAJAJAJAJAJAJAJAJAJA Wikipedia jaja XD haha llamaba obstáculos Superman cigarros tráigame Pepito agotado,0
calentado cortante adolescente traía JAJAJAJAJJAJA,0
ajajaja peluquería pololear 400 adivinas cojo,0
quitó Acuario coff ajajajaja cubo musicales JAJAJAJAJAJAJAJAJAJAJAJAJAJAJAJAJAJAJAJAJAJJA,0
moco profesores @chistegenialxd platicar condon Condones tirada trigo Página,0
Judas jajajs sencillos cojo bipolar,0
Jajajajajajajajajajaajajajajaja cabezas zapato,0
aplausos diarios JAJAJAJAJAJAJAJAJAJAJAJAJAJAJAJAJAJAJAJAJAJAJAJAJAJAJAJAJAJAJAJAJAJAJAJAJJAJAJAJAJAJ Eva iPad cayo jajajajajajaja mecánico McDonalds,0
espacial viagra cuéntame teléfonos buajajajajajaja JAJAJA,0
brillante Eva quemó ginecólogo JAJAJAJAJAAJJA Formas bala Cancelar @chistegenialxd flota,0
ESE Pato Nemo,0
mozo jajahaa caíste Maestra Fíjate mordió Pato tenían,0
#JajaChistesGAME smartphone mecánico,0
cojo JAJAAJAJAJAJAJAJAJAJA AMIGOS #JAJAJA mago SOLA sorprendido cojo caería curvas Jajajajajajjajajajaja jajajaj Niñas,0
JAJAJAJJAA enchufe JAJJAJAJAJAJAJAA funcionaba JAJAvsiamlAñobgrfnkJAJAJA ratones Sra caníbal Soltero comillas árbol Ahahah vendedor,0
mataron Genial femenino Condones ajaja callado Genial Gay llamé Cancelar durísimo peluquero euros Póngase bala,0
bebida cigarros,0
400 nieto naranjas Idea zombie sencillos _ʃʃ AJAJAJAJAJAJAJ Salvador anciana japonés akdjajajaja chicles,0
Salimos tuvieras velas profesores alcohólico CARA tartamudo óptica piojos CAGUÉ astronautas juguete tos,0
manzanas Tantos,0
cayo SUPUTAMADRE JAJAJÁ jaimito leyenda gastos autocorrector Perdone Cuándo astronautas,0
funeral #jajaja Cancelar Camarero sardina Andrea monjas burro JAJAJAJAJA tenis monja ajajajaj peluquero dejá,0
jajajajaaja televisión,0
JAAJAJA . ... Newton espermatozoide monjas JAJAJAJAJAJASUELTENME probado jaimito Eva @HADACON taxista Wikipedia,0
engaña cucarachas monja @HADACON pestañas pistola veterinario haha Galaxy Mijo ramita Quiénes,0
JAJAJAJÁ peluquero fáciles Awwww,0
JAJAJAJAJAJAJAJAJAJAJAJAJAJAJA sacaste obstáculos Jajajjajajjaja cadáver bebida Napoleón escalera adivinas Abraham orgía juguete prehistoria ajjaja,0
confundido Formas Habia Chica lol JAJAJAJAJAJAJAAJJAJAA ninfómana superficie,0
bartender jajajs Hija jjajajajajjajajajaja Inmaduro AMIGOS Gay JAJACHISTES cocodrilo Tinder ajajajaja LOLLA Abrir tos,0
estatura fórmula llola,0
Mickey bobo escala CRISTOJAJAAJA toc JÁ árbol . ... astronauta subiste Hacemos cabezas Viejo Entendieron jajajajajja,0
#JajaChistes Cuándo Excepto prostitutas enojaste clitoris finalmente Shake casaron,0
JAJAJAJAJAJAJAJAJAJAJAJAJAJAJAJAJAJAJAJAJAJAJAJAJAJAJAJAJAJAJAJAJAJAJAJAJAJAJ,0
arreglo pepito bobo jajjajaja xddddddddd #ChisteMachista JAJÁ cabezas Abrir juguete Jajajja,0
tuvieras Inmaduro JAJAJAJAJAJASUELTENME JAJAJAJAJAJAJAJAJAJAJA #Cortitos probado,0
Lola escoba Habia Galaxy euros quítate #xD Jajaj LOLA monjas engaña preservativo Chica pollitos hijito,0
ballena clitoris Querida 5000 #4toCumpleañosJajaChistes,0
HAHAHAHAHH ingeniero,0
JAJAJAAJAJAJA autos responda,0
sabido JAJAJAJAJAJAJA vitaminas #jajaja Perdone carpintero adoptado Samsung #Hum Lola HAHAHAHAHH ácido . . nave,0
descubrió JAJACHISTES #SuperligaOrangeLoL7 carpintero #SuperligaOrangeLoL7 haha campanas obstáculos telón,0
2acto Eva llamarse estatura Mickey HIJO jajaa hazme WiFi viagra piojo JAJAJAJAJAJAJJAJAA Auxilio,0
"lol #CHISTE JAJAJAJAAJAJAJA .
. ajajjajajaj trajiste JAJA conocimos Tome JAJAJAJAJAJAJJAJA",0
incorrecta relleno clitoris Nemo jajahaa JAJAJAJAAJAJJA autocorrector @hadacon orgía Galaxy iPod,0
Vienes deme sordo leones asustado funcionaba Cuándo ATTE pestañas tratamiento condon 365 Viste JAJAJAA objeto,0
xdddddd adivinas jajajajajajajajsjajajjasj JAJAJAJAJAJAJAJAJAJAJAJAJAJAJAJAJAJAJAJAJAJAJAJAAJAJAJAJAJA remoto incorrecta 365 llamó respondió,0
Gay JAJAJAJA Acto JAJAJÁ Empieza Salimos astronautas Jajajjaa funcionaba Idiota Salvador casaron,0
Pepito SUPUTAMADRE gritó ajajajajaja jajajá Ajajajajaja lol logré,0
flota Lógica Jajajá . . metí buajajajajajaja magos,0
Drácula JÁ marque Juana felicito #Los10MandamientosDelVago Harlem prostitutas zombie África JAJAJAJAJAJAJAJAJAJAJAJAJAJAJAJAJAJAJA,0
millonaria JAJAJAJAJAJAJAJAJAJAJAJAJAJA 4x4 restaurante órganos Pedrito,0
Entienden Testigos Trabajas fáciles flojo caracol,0
JAJAJAAJAJAJA llamó JAJAJAJAJÁ discapacitados JAAJAJA Neymar NOO,0
1acto dejá Tijeras Callate televisor Jajajá Pato albañiles hacés Capitán Lógica serías,0
JAJAJAJAJAJAJAJÁ clitoris mapa HAHAHAHAHH Salvador postre peroJAJAJAJAA 2acto JAJÁ llevaban,0
#JAJAJA cobra JAJAJAJAAJJAJAJAJAJAJA Adivina GráficoJAJAJAJAJJA Chica CORRAN Señorita,0
corres JAJAJAAJA orgía probado científico Thomas @chistegenialxd Vienes CUÁL CORRAN cupido haha Jajajajajajajaj Formas alcohólicos,0
JAJAJAJAJAJAJAJAJAJAJAJAJAJAJAJAJAJAJA JAJAJAJAJAJAJA Soltero Ahahah HAHAHAHA Maestra two,0
prestas Soldado,0
Hablo funcionar jajajá llamaste virginidad Style cocodrilo Hablo,0
250 Maestra Traduzca tirada JAJAJAJJAJAA gemelos palomas Jajajajajajajajaja estómago responda sabido Jajajajajajajaja traducir Pikachu,0
profesores automático millonaria Jaja espacial bombillo perezoso JAJAJAJAJJAJA,0
jajahaa Chapo #ChisteMachista haha jajajajajja JAJAJASUELTENME Tranquila meterlo,0
fórmula árbol alteré Jaja ajaja óptica,0
lollapalooza brillante jajajjaj Pikachu jajajajajaj llamó Soldado flaquita Mirá,0
Perfil estatura farmacia,0
Disculpa POLICÍA . . inodoro POLICÍA remoto JAJAJAJJAJAA akdjajajaja ninfómana JaJaJa principal,0
barrer alcohólicos,0
remoto astronauta crudo @CamilaTuDiosaxD JAJAJAJAJAJAJAJAJAJAJAJAJAJAJAJAJAJAJAJAJAJAJA Jajajja caería casan jajajajaaja WiFi babor chango restaurante JAJAJAJAJAJAJAJAJAJAJAJAJAJAJAJAJÁ,0
colchones,0
CULO 2acto cumplido Perdone caracol #JAJAJÁ CORRAN JAJAJAJAJAJAJAJAJAJ Ray Nemo,0
taxista trajiste JAJAJAJAJAJA flaquita JAJAJAJAJAJAJAJAJAJAJAJAJAJAJAJAJAJAJAJAJAJAJA jajajaja Pregúntale Jelipe computador,0
JAJAJAJA árabe,0
xddddddddd pepito Wikipedia Viste,0
Póngase cucarachas traficante,0
peluquero #ChisteMachista,0
Terminator,0
ginecólogo gravedad mozo Jajajajajaja casaron seco mataron Terminamos remedios Inglés fíjate ELIJO camarero Acaso blancos,0
Comida CRISTOJAJAAJA,0
barrer jajajajajaj descubrió DiCaprio SUPUTAMADRE jajajajajaj,0
peinado rompecabezas rayo ascensor encerrado,0
Piensalo cadáver pollito aguantas pololo regresa leyenda,0
cuchillo cayo ⇆ frenos JAJAJAJAAJAJJAJ pololo JAJAJAJJAJAJ Superman ofrezco JAJAJAJAJAJ Pikachu Viejo JAJAJAJAAY,0
rayo JAJAJAJAJAJAJAJAJAJAJAJAJAJAJAJAJAJAJAJAJAJAJAJAJA ácido gritaron #CHISTE sillas cayo bartender traía escoba,0
pajarito Thor jajajajajajja Testigos #jajaja JAJAJAJAJAJAJAJAJAJAJAJAJAJAJAJAJAJAJAJAJAJAJA,0
frenos ácido #CHISTE Alcohol,0
Titanic AMIGOS JAJAJAJAJA Aw clitoris ajajajja ordenadores JAJAJAJAJAJAJÁ pájaro,0
tigres piojo JAJAJAJAJAJAJAJAJAJAJAJAJAJAJAJAJAJAJAJAJAJAJAJAAJAJAJAJAJA sacerdote prostituta ajajajajaja ESE,0
Abrir visa Vienes Lógica recreo curvas noooo Wikipedia Desea,0
bebo Trabajas Mijo Supe smartphone servir espacial JAJAJAJAJAJAJAJA álgebra bebo cenizas taxista sapo,0
gluglu casemos moscas DiCaprio Style jajajjaj peces profesores Hago ABUELO Inicio,0
JAJAJAJAAJAJJA caería Jajajajajajajajajajaja musicales mozo agotado jjajajjajajajjajaja,0
corres Perdone JAJAJAJAJAJAJAAJJAJAA JAJAJAJAJAJAJAJÁ Doc vendrá pollitos campanas,0
JAJAJAAJ estatura Jajajajaja jajajja jajajs,0
diagnóstico Recuerdas terapeuta POLICÍA #humortico Inmaduro Planet bebida jaula bipolar Cállate ³ JAJAJAJAJAJÁ higiénico,0
isla palomas JAJAJAJASUELTENMEAPENAS Lógica JAJAJAJAJAJAJAJA trasero carpintero PIZZA supuesto Escribiendo virginidad objeto Shake Viejo ❒,0
JAJSJAJAJAJAJA echas AJAJAJAJAJAJAJ McDonalds Lógica secretaria adolescente JAJAJAJAJAJAJÁ Jajajjajajjaja Abrir sacerdote terapia JAJAJAJAJAJAAJJAJAAAJ reuniones JAJAJAJAJAJASUELTENME,0
xD supuesto Perdone Lola confundido JAJAJAJAJAJAJAJÁ repito tiposJAJAJA 365,0
recientes relleno,0
Genial sordo funcionaba Úselo Planet cogí terapeuta Contratado noooo Traduzca,0
JAJAJAJAJAJANo recientes actor JAJAJAJJAJAJ Doc Salimos ³ gluglu terapeuta ratones jajajsjaj JAJAJAJAJAJAJAJAJAJAJAJAJAJAJAJAJAJAJAJAJAJJA Traduzca JAJAJAJASUELTENME pepito,0
sabido Comida flaquita JAJAJAJAJAJAJAJAJAJAJAJAJAJAJAJAJAJAJAJAJAJAJAJAJAJAJAJAJAJAJAJAJAJAJAJAJAJAJ JAJACHISTES Salud alcoholismo jajajajaj Bruce ahorro traga comillas Perfil,0
JAjajajajajajajajajajajajajajajajajajajaaja Bruce esposas Pepito Soltero JAJAJAJAJAJAJAJAJAJAJAJAJAJAJAJAJAJAJA escoba blancos JAJAJJAJAJA Pedrito JAJAJAJAJAJAJÁ,0
campanas brillante velorio ordenador Shake Chiste,0
supo presta servirle xdddddd flaquita principal cobra xddddddddd,0
Ray xdddd,0
JAJAJAJAJAJAJAJAJAJAJAJAJAJAJAJAJAJAJAJAJAJAJAJAJAJAJAJAJAJAJAJAJAJA Hablo jajaja JAJAJAJAJAJASUELTENME ajaja Ajajajajaja árabe Sufrir Deme cupido JAJAJAJAJAJÁ,0
hacés,0
HAHAHAH Muere jajaj JAJAJAJAJJAJAJAJAJAJAJAJAJJAJAJAJAJAJAJAJAJAJAJAJAJA #FrasesLocas whisky colchones parcialmente Mire sencillos,0
astronauta cortaron,0
Nemo cumplido noooo Duermo HIJO compuesto JAJAJAJAJAJAJJAJAA █ JAJAJAJASUELTENMEAPENAS Lógica,0
Chiste bañando llevaron rió jajajaajajajajajaj postre cigarros,0
ácido jaimito whisky científicos psicólogos Wikipedia llevaron JAJAJAJAJAJAJAJAJAJAJAJAJAJAJAJAJAJAJAJAJAJAJAJAJA,0
cuéntale tijera lollapalooza JAJAJAJAJAJAJAJAJAJ canguro pollito bipolar ardilla bobo Señorita champú prestas relleno ajajaja,0
JAJAJAJAJAJAJAJAJAJ higiénico Escucha jajajajajajajajaja #4toCumpleañosJajaChistes xD pon marque tenis toro,0
mmm JAJAJAJAJAJAJAJAJAJAJA gritas #Humor Salud condon,0
Dígame diagnóstico clitoris solita Lógica barrer ajajajajaja,0
objeto Chiste JAJAJA Inglés HAHAHAHA jajaa tiré JAJAJAJAJAJAJAJAJA jajajajaaja vendedor tsunami tacaño Compadre,0
Hablo LOLLA Vienes letrero JAJJJAJAAJAJAJAJJA,0
⇆ Jelipe,0
diviJAJAJAJ reencarnación tenían =D Pase Hablo,0
patos jajajá vidrio baterías olvídalo OVNI carpintero JAJAJAJAJAJAJ ninfómana Harlem,0
millonaria #JajaChistes alteré adoptado virginidad Quiénes árabe JAJAJAJAJAJANo pollitos JAJAJAJAAY,0
365 llola Jajaja #JuegosJajaChistes,0
sacerdote gemelos Hija burro Jelipe Nemo trasero objeto CAGUÉ JAJACHISTES llamaste,0
corres Ring calentado Jajajajaajajajajajajajauajajaja Jajajajajajajajajajajajajaja Abraham JAJAJAJAJAJAJ,0
sencillos Fea regresó tardas Shake confesarlo,0
cayo pajarito tratamiento Shake Pato Bestia pasame Pepito,0
#JAJAJA repito Newton DiCaprio bebés,0
conejo pollito jajjajaja jajjaja sabido ajajajajajaajaj subiste tos alteré superficie caracol,0
tiré JAJAJAJAJAJAJAJAJAJAJAJAJAJA,0
Segura autopsia Joven supuesto JAJAJAJA jajajajajajja Harlem JAJAJAJAJAJAJAJAJAJAJAJAJAJAJAJAJAJAJAJAJAJAJA bebés celulares 2acto jajajajajaj,0
obsesionada probado Coger astronautas Ray lolaso bolita Ajajaja patos calculadora Supe vegetariano nublado curvas pestañas,0
HIJO trigo Coca-Cola Viejo Salvador JAJAJAJAJAJAA bombillo científicos asustado,0
Pitbull científico profesores Ayy HAHAHAHA,0
probó #FrasesLocas #Anecd sandwich NOO baba,0
jajajaja piojos Godzilla sardina ―,0
leggins Tierra íbamos probó TOC dejá #Chiste Alzheimer femenino . ...,0
#XD Inmaduro Pick Shake blancos champú JAJAJ Perfil tijera análisis Agua cadáver conducir,0
JAJJJAJAAJAJAJAJJA farmacia Gallina Póngase culpable Chiste nave caería móviles ♌ @chistegenialxd,0
cadáver femenino dejá funcionaba,0
Daña Naces cocodrilo autos incorrecta babor profesores Piensalo hahaha Jaimito Jajajá nublado,0
Acuario ABUELO Toc leones terapia,0
árabe JAJAJAJAJÁ aguantas,0
pololear #Hahaween,0
cogí Muere tiré,0
llamaría científicos prehistoria Alzheimer felicito logré lollapalooza obstáculos xdddddd JAJAJJAJAJAAJA amarillo remedios gemelos Dile JAJSJAJAJAJAJA,0
frutas xddddd análisis Salud culpable pollitos,0
Agua jajajja sorprendido,0
JAJAJAJAJAJAAJJAJAAAJ coges Pitbull jaimito Genial platicar Jajajjaa jajajajajajajajaja toc taxista cigüeña jardinero,0
".
. árbol veterinario Traduzca grité Jajajja estudias JAJAJÁ",0
ATTE Póngase confesarlo serías postre espermatozoide autocorrector CRISTOJAJAAJA inodoro jajahaa #JAJAJA conducir . .,0
cabezas ❒ cobra coff encerrado sacaste jajajsjaj @JajaChistes Jajajajajá JAJAJAJAJAJAJAJAJAJAJAJAJAJAJAJAJAJAJAJAJAJAAJAJAJAJAJAJAJAJAJAJAJA desordenada Cuáles pololear,0
buzo reencarnación vitaminas Jajajajaj astronauta jaja magos rayo #Hahaween Hacemos corres JAJAJAJAAJJAJAJAJAJAJA Mijo testigos amarillo,0
Página,0
pollito JAJAJAJAAJJAJAJAJAJAJA Mijo,0
JAJAJAJAJAJAJAJ profesores buzo culpable ⇆,0
Sagua'aJAJAJA _ʃʃ Recuerdas Genial jardinero harías Maestra #JuegosJajaChistes #JuegosJajaChistes Idiota bebés jajajajajajja bolígrafo laboral,0
Cuelga jajajjajajajaja PIZZA,0
JAJAJAJAAJAJAJA Empieza Vienes mudo hada tigres escribí tenedor conocimos #Humor finalmente Habia,0
ajjaja xdddd Loladrones flota felicito cobra jajajaa CO AJJJJAJJAJAJAJJA Ray rompecabezas Wikipedia logré Terminator,0
diseñador,0
³ AJAJJAJAJAJAJAJAJA JAJAvsiamlAñobgrfnkJAJAJA HAHAHAH jajajajajajajajajavier secretaria Ajajaja psicólogos funeral solita cadáver alteré mozo #JAJAJJA,0
JAJAJAJAJJAJAJAJAJAJAJAJAJJAJAJAJAJAJAJAJAJAJAJAJAJA Ajjajaajajaja Viagra Planet,0
crudo JAJAJAJAJ albañiles jajajaja Tantos escala pepito virus Pikachu,0
JAJAJAJAJAJÁ,0
escalera cuéntale cobra defendiendo masturbación actor televisor jajajajajajaja,0
nieto haha jajaa Tantos moscas Jajajajajajjajajajaja LoL #4toCumpleañosJajaChistes,0
Piensalo,0
Má,0
#JAJAJA LOLA Doc sentarse Excepto JAJAJAJJAJAJA Napoleón Década Bestia,0
Batman Planet marque JAJACHISTES Chin Pepito cubo JAJAJAJJAA Gallina JAJAJAJAJAJAJAJAJAJAJAJAJAJAJAJAJAJAJAJAJAJAJAJAJA Trabajas chango nave finalmente Ajajajajaja,0
LOLLA olla,0
Pregúntale Salimos corres cuchillo,0
cuelga,0
lolla confundido Harlem sacaste ajedrez JAJSJAJAJAJAJA llevaron Fíjate apuesta Conoces marque #JAJAJÁ Luna,0
llamé rama,0
principal Wikipedia AJAJAJAJAJAJAJAJAJAJA AMIGOS Jajajajajajjajajajaja JAJJAJAJAJAJAJAA Lola JAJAJAJAJAJAJAJAJAJAJAJAJAJAJA 1acto Traduzca Jajajajaj champú,0
menú Harlem frutas Tienen revisando Jajajajaj trajiste CRISTOJAJAAJA Genial ji escalera palomas tirada Duermo,0
inodoro apareció calentado casaste buzo cortaron Gallina,0
ofrezco automático,0
regresó Narnia coff Ring,0
Chin tiraste planta Tome Sabés desordenada ATTE planeado,0
Úselo despiden Coca-Cola JAJAJAJAJA euros √ Jajajaja JAJAJAJAJAJAAJJAJAAAJ teléfonos bebés jajajajjajaja cuéntale sentar ajajaja,0
Cuelga #Humor Camarero actor Fíjate,0
servirle Xd @HADACON ATTE Chin copiando Superman rayo tinta lolla noooo xdddddd,0
estómago Querida Eva Jajajajajajajaja Dile traficante adoptado tiraste AJJJJAJJAJAJAJJA JAJAJAJA,0
JAJAJAJA,0
jaja arrastrándose funeral transformer Formas estufa cayo,0
seco frutas tardas,0
prostitutas Supe jajajajajajajajaja JÁ JÁ #Humor #FreeLoLa Perdone Quiénes rompecabezas jajajajaj defendiendo Jajajjajajjaja nació encerrado,0
#Hahaween #CHISTE,0
xddddd Newton asustado JÁ HAHAHAHAHH ajjajaja CORRAN mmm Thomas femenino pollitos,0
Jajaj JAJAJAJAJAJAJAJAJAJAJAJAJAJAJAJAJAJAJAJAJAJAJAJAJA casemos Wikipedia JAJAJAJAJAJÁ escala Neymar Chica hijita lolaso Camarero jajajajjajaja ordenador presentó JAJAJAJAAY,0
amarillo blancos Sra,0
#Los10MandamientosDelVago Sufrir celulares Escucha operación Cancelar JAJAJÁ,0
Quiénes Acuario Pikachu Godzilla smartphone xdddddd jajajajajaja Hahaha JAJAJAJ JAJAJAJAJAJAJJAJAA Abrir naranjas millonaria Cuelga Xd,0
Pato aplausos JAJAJAJJAJAA metí Hulk apuesta JAJAJAJAJ jajajajajjajajajajaj Pase Coca-Cola,0
champú ajaja traga óptica autopsia CORRAN,0
ji quítate jajajja,0
jajajajaja LOLA ELIJO JAAJAJA Jelipe supo JAJAJAJ ESE Jajajajja dálmata respondió tráigame lol,0
NOO sardina Daña nieto babor servir smartphone planta carpintero Barney Hago sacaste jaja,0
profesores podía Tome rayo llámame,0
computador peces DiCaprio Camarero Jajajajajá #FrasesLocas,0
=D psicólogos caíste confundido,0
#Hum JAJAJAJAAJJAJAJAJAJAJA CUÁL Testigos patos buajajajajajaja mmm frutas bebés tirada JAJAJAJAJAJAJAJAJAJAJAJAJAJAJAJAJAJAJAJAJAJAJAJAJAJAJAJAJAJAJAJAJAJA servirle Jelipe tirada,0
llevaron 250 dirías tirada metí Jajajajajajajajajajaajajajajaja Barney,0
operación celulares matrimonio curvas Jajajajaj cinturón Viejo JAJAJAAJA íbamos Per,0
inodoro ❒ Pafuera terror casemos bobo reproducirte JAJAJAJAJAJAJAJAJAJAJAJAJAJAJAJAJAJAJAJAJAJAAJAJAJAJAJAJAJAJAJAJAJA cayo crece Creces,0
gritó cayo sardina Bruce AJJJJAJJAJAJAJJA Sufrir ajaja _ʃʃ rió HERMOSO finalmente quítate,0
gluglu corres supo Pick Adivina #ChisteMachista LoL JAJÁ televisión halloween seco prehistoria fáciles ofrezco,0
pololo,0
reproducirte crece órganos HAHAHAHAHH barrer Perdone LOL ♌ funcionan Vienes Bruce LOLA Bruce jajajsjaj,0
#Chiste Xd xd,0
#SuperligaOrangeLoL7 tuvieras Fea compuesto,0
diviJAJAJAJ,0
ajaja taxista Auxilio Sagua'aJAJAJA Piensalo ginecólogo maquillada patos POLICÍA zoológico ninfómana Sarahaha,0
ajjaja sardina ji,0
responda tiré pajarito Jajajajajajajaja DiCaprio reencarnación magos JAjajajajajajajajajajajajajajajajajajajaaja monja @chistegenialxd mordió Ajajajajaja,0
Andrea funcionar,0
casaste Vienes Thor Entienden JAJAJÁ #Hahaween ajajajajajaajaj actor fáciles volvieron Conclusión #Cortitos cadáver,0
baterías Gay Per #Chiste ABUELO hijito magos Domino's lollapalooza Entendieron ajjajaja remedios casados quitó Bruce,0
reproducirte estallaJAJAJA,0
Toc,0
terapeuta Creces serías JAJAJAJAJAJAJAJAJAJAJAJAJAJAJAJAJAJAJAJAJAJAAJAJAJAJAJAJAJAJAJAJAJA Pepito JAJAJAJA,0
Entendieron 2acto JAJA condon Jajajjaa vidrio terapeuta #XD JAJAJASUELTENME agujero velorio peces,0
HAHAHAH quitó corres casaron JAJAJAJAJAJAJAJAJAJAJAJAJAJAJAJAJAJAJAJAJAJAAJAJAJAJAJAJAJAJAJAJAJA,0
lol llevaron Style magos bartender,0
llamarse rompecabezas Taxi oveja preservativo JAJAJAJAJAJAJAJAJAJAJAJAJAJAJAJAJAJAJAJAJAJAAJAJAJAJAJAJAJAJAJAJAJA vegetariano marque revisando aparato ajjaja Alzheimer Superman Drácula #LOL,0
JÁ pollito,0
fáciles reproducirte #FelizCumpleañosJajaChistes Sagua'aJAJAJA jaula Tierra #XD,0
autocorrector sacaste matrimonio Inglés volvieron gastas Segura #XD #xD #Anecdotas CRISTOJAJAAJA jajajajajajaja,0
jardinero Jajajajajajajajajajaja seco jajajajajja,0
lollapalooza esposas Jajajajajajjajajajaja,0
llamaré ajjajaja incorrecta chicles,0
Drácula responda tuvieras JAjajajajajajajajajajajajajajajajajajajaaja ardilla Vino SUPUTAMADRE Inicio prestas JAJAJAJAJAJAJAJAJA ramita Daña durísimo Style,0
ajajajja Narnia tortugas piojo repito Callate bolígrafo,0
agujero,0
JAJAJAAJA Xd,0
JAJAJAAJA Creces jajajaajajajajajaj,0
Gangnam halloween,0
Ray Viagra JÁJAJAJAJAJ apuesta Salvador @CamilaTuDiosaxD 2y patos JAJAJAJAAY carpintero Thor masturbación XD Narnia,0
xd Pene ingeniero,0
corres letrero corres Niño xd felicito JAJAJAJAJAJAJAJAJAJA #Humor Condones sordo LOLA,0
reuniones jajaa #xD toc JAJAJAJAJAJAJAJAJAJAJAJAJAJAJAJAJAJAJA confundido estallaJAJAJA lolaso Jajajajajajaja PIZZA despiden Escucha Deme martillo Sarahaha,0
obsesionada llamé Pato velas bañando Duermo prostitutas Comida escalera mozo #chistesmalos Perdone,0
manzanas ajajaj xD secretaria funeral caracol JAJAJAJASUELTENME juguete Wikipedia monja rama,0
Jajajajajajajaj LOLLA Excepto Viste Formas Empieza dálmata cadáver obsesionada bebés,0
currículum corres hada Compadre astronauta ajajajajaja principal xdxd sencillos,0
felicito dálmata toro jajajajajajajajajajajajajaja JAJAJAJAJAJAJAJAJAJAJAJAJAJAJAJAJAJAJAJAJAJAJAJAJA casaste jajajaajajajajajaj Judas gluglu,0
científicos #FelizCumpleañosJajaChistes jajajajsjjjja ballena japonés escalera trajiste gastas Sagua'aJAJAJA Capitán,0
alcohólicos pololo jajajs Jajajajajajjajajajaja nube Jajaj alcohólicos estallaJAJAJA jajajajjajaja diagnóstico #Chiste,0
científicos quitó hijita conocimos cuchillo metí,0
caíste bañando DiCaprio isla ajajajja Chin peces Camarero jajaja JAJAJAJAJAJAJAJAJAJAJAJAJAJAJAJAJAJAJAJAJAJAJAJAJAJAJAJAJAJAJAJAJAJAJAJAJJAJAJAJAJAJ Jajá serpiente,0
podía lolla bebo terapia Viejo celulares Disculpa diagnóstico ajajajaja Acto,0
jajajajajajajajajajajajajajajajajajajaj Jajajajjaja postre menú leones ‎,0
JAJAJ Coger,0
monja funeral Buajaja esposas deme,0
4x4 JAJAJAJAJAJAJAJAJAJAJAJAJAJA Comida JAJJAJAJAJAJAJAA peces Cállese ajjajaja manco jajajajajajjajq cuéntame aplausos Adelante pajarito,0
Bruce astronauta Señorita Gangnam apareció Sarahaha Naces manzanas JAJAJAJAJAJASUELTENME estudias Jajajjaa postre Animal Juana felicito,0
caracol gritas naranjas Escribiendo whisky JAJAJAJAJAJAJAJAJAJA Napoleón monja órganos Jajajajajajajajajajajajajajajajajajaja tigres CULO Jajajajajajajajajajajajajajajajajajaja escala,0
postre #JajaChistes,0
Hija ajajaj JAJACHISTES Página,0
